aboutText,age,caste,city,college,employedIn,height,profileID,religion
"I  believe in simplicity.. I love music, painting, cooking and  talking on different topics. I am purely veg person. I can prepare non-veg but i don't like to eat. I want such person who will understand me, my requirement. Person whom I want to marry he also respect me and my feelings. I want a very good friend rather than a husband. In our relationship I am excepting full transperency in all aspects. I should know his past, present & future also and same time he should also know my past present & future.",42,Bhandari,"Mumbai, Maharashtra, India",,,5ft 2in,mumf1066499,Hindu
"Hi, I'm well mannered, well cultured mid mod girl with pleasant personality and good sense of humor. I'm mischievous girl and enjoying my nature without harming anybody. Cooking is my passion. I love talking and making friends. I'm highly qualified girl and completed my education from reputed school and college. ",42,Vaishnav Vanik,"Mumbai, Maharashtra, India",,,5ft 4in,thaf1382354,Hindu
"simple ,intelligent,matured,loving caring, honest, loyal,,straightforward,a person of giving nature,good looking, good personality,loves nature, long walk on the beach, loves to read books on health n fitness,loves to decorate the house n loves to travel n loves hindi n english movies n loves film songs n new age music.........a spiritual person",42,Vaishnav,"Mumbai, Maharashtra, India",,,5ft 4in,mumf1362421,Hindu
"We belong to respectable family from uttar pradesh. My sister is simple, fair and sharp featured She has done graduation then p.g in computers. We are two brothers and two sisters. My father is retired.",42,Kayastha,"Delhi, Delhi, India",,Not Working,5ft 2in,delf1354320,Hindu
"In childhood (in 1984) she underwent an operation due to which her left arm is shorter by about 2 inches; but it is functional. Her brother and sister (both younger and married ) are in US. She is a permanent lecturer in the centaral university, Delhi.Simple living, but modern thinking. ",42,Agarwal,"Jaipur, Rajasthan, India",,Central Government,5ft 2in,0006099626,Hindu
"I am witty by nature, very unassuming, caring, kind at heart and hard working. Speaks my heart and mind out, hence one may call me Outspoken.Talkative n gets along with anybody without any hassles. Easy going n very humorous. 
",42,Rajput,"Navi Mumbai, Maharashtra, India",,,5ft 2in,navf980496,Hindu
"She is simple, sober and a cultured girl. Graduate from kalindi college, New Delhi. Have done Computer Application course from NIIT. Belongs to a family with moderate values. Apart from her, our family consists of her father, mother, 2 younger sisters and one younger brother.  ",42,Brahmin,"Delhi, Delhi, India","Other College, Delhi University",Others,5ft,delf1213544,Hindu
"My daughter is an Advocate. Her hobbies are gardening, listening Hindi songs. She was born in Solapur and brought up in Hyderabad. She is very caring and hardworking person. Father is retired from APSEB and mother is a housewife.",42,Swakula Sali,"Secunderabad, Andhra Pradesh, India",,,5ft 1in,hydf942671,Hindu
"She is born in Solapur and brought up at Hyderabad. She is very caring and responsible girl. Likes gardening, listening Hindi song and reading. ",42,Swakula Sali,"Hyderabad, Andhra Pradesh, India",,Private Sector,5ft 1in,hydf951340,Hindu
"Having traveled to a few countries, I believe my habits over the past few years has emerged to be a blend of the western world and the good old traditional India. I like keeping a good home, a garden enthusiast, foodie, and like the occasional vacationing (not more than 2 times a year. I like having friends and family over and enjoy a good laugh quite often. Movie buff, like to dress well and live a decently good life.Not a great chef, but can turn out a decent meal, not a fan of eating out very regularly. I believe respecting my man is a very important factor in the relationship and I expect it to be reciprocated. I can positively say that I am great fun to be with.    ",42,,"Bangalore, Karnataka, India",Bangalore University,MNC,5ft 8in,SMF1549628,Hindu
"I AM A SIMPLE GIRL. MY WORLD REVOLVES AROUND MY FAMILY. I LIKE HONESTY AND COMPLETE DEVOTION IN WHATEVER I DO. I AM A BELIEVER OF GOD, PROUD TO BE AN INDIAN. I HAVE CERTAIN VALUES IN LIFE AND I FOLLOW THEM, BORN AND BROUGHT UP IN A MIDDLE CLASS FAMILY HAS MADE ME FLEXIBLE. ",42,,"Mumbai, Maharashtra, India","Shivaji University, Maharashtra",Private Sector,5ft,SMF1518305,Hindu
"simple, down to earth, tall, smart, like to cook, watch films occasionally, like to listen music
i look much younger than my age
looking for a good natured, mature, understanding partner",42,Mali,"Pune, Maharashtra, India",,,5ft 6in,punf1274183,Hindu
"I feel pleasure in sharing my precious time only with myself. Hence I submit all my thought to myself only. I am a best friend of my own. Being shy in nature I am not much comfortable with people and keep distance from them. 
Usually thoughts vary according to ones personality and sometimes it influences othersÃ¢Â€Â™. ThatÃ¢Â€Â™s why I donÃ¢Â€Â™t like to disclose my opinion in front of others. Some circumstances in my past life have made me less social. 
Self dependent and being a teacher I have to handle different types of problems in my profession, perhaps this is the one of the reason I have now gained expertise in handling difficult situations. 
Life Ã¢Â€Â“ is game of pain and pleasure. Suffering became my master and taught me Ã¢Â€Â“ courage, persistence and patience. I believe in the power of God as he has blessed me all those strength that I need to overcome the challenges of life. In spite of that I see- life is beautiful! 
I am religious. All road leads to one God and I truly believe that the best service to God is to serve humanity. 
I am a very simple and a sober girl with adjustable nature and have my full devotion to my work and family at same time. After my job and house hold chores I like reading article and books. Sometimes my school work also keeps me busy. When I have time I spend it with my Mother as she watched her favorite shows on television. 
In my career I do not have high hopes and ambitions; I work hard to get hike and growth in profile in my near future. Apart from all these I want to pursue MBA to get higher professional education.",42,Arora,"Faridabad, Haryana, India",,Public Sector,5ft 2in,delf1285201,Hindu
"Hi, I am Bhagyashree Anvekar. I have completed my Bachelors in Finance. I am currently working as a Finance Professional. My friends describe me as: confident and outgoing person with a good sense of humor. Likes singing, reading and cooking. ",42,Brahmin - Davadnya,"Mumbai, Maharashtra, India",,,5ft 4in,mahf623774,Hindu
"I am smart with young looking, modern but traditional person. Father Retd. Gazetted Officer worked in Delhi Doordarshan, mother expired, only one younger sister married. ",42,Brahmin - Gour,"Noida, Uttar Pradesh, India",,,5ft 4in,delf662332,Hindu
"MY DAUGHTER IS GOOD LOOKING ,LOOKING YOUNG , EDUCATED IN SALWAN PUBLICSCHOOL,DELHI,B.SC(HONS),M.SC.(PHYSICS) &B.ED ALL FROM DELHI,UNIVERSITY,EXCELLENT ACADEMIC RECORD,TEACHING PHYSICS TO 11TH &12TH IN REPUTED PUBLIC SCHOOL,HERELDER BROTHER &SISTER ARE MARRIED & HOLDING  VERY HIGH GOVT. POSTS, WANT EARLY MARRIAGE.",42,Brahmin,,,Private Sector,5ft 5in,delf872591,Hindu
Simple and straightforward. I have a sense of humor. I am basically from an academic background. I like to read and travel. I am sincere and loyal and expect the same from others. I am looking for a well read and kind partner.,42,Brahmin - Iyengar,"Bangalore, Karnataka, India",,Others,5ft 4in,SMF1503008,Hindu
"This is a profile for my sister. She suffered setbacks during 2009 when her husband and son expired within a gap of six months. My sister is self employed. She is a kind-hearted and a simple person with balanced values.We are looking for a suitable match who is educated , caring and sympathetic.someone with whom my sister will be able to connect to love and be loved.

",42,Brahmin - Bengali,"Durg, Chhattisgarh, India",,,5ft 2in,durf1035209,Hindu
"she is matured, sensible and understanding. very joyful in nature and could be the best life partner.  a bit heavy in her physique but very apt in all household work and other activities of day to day life...........",42,Garhwali Rajput,"Dehradun, Uttaranchal, India",,Not Working,5ft 2in,dehf392782,Hindu
An exuberant woman with a cheerful ringing voice...love to socialize and meet new people..enjoy exploring new places...can prepare dishes with deft skill..an avid reader..books consume my attention....,42,Punjabi,"Rest of West Bengal, West Bengal, India",,,5ft 8in,gujf612319,Hindu
"I am a very simple, caring and honest person, living with my parents and working as a Teacher in the school. ",42,Protestant,"Kanpur, Uttar Pradesh, India",,Private Sector,5ft 2in,kanf206514,Christian
"I am a professional technical writer and am currently located in NCR. I stay with my mother in Ghaziabad. My only one elder brother is married and settled in West Bengal. My elder sister is married and settled in Ghaziabad itself. I love to maintain human and cultural values. I like traveling, light music, reading, watching movies and meeting people. I am seeking alliance with an educated, honest and professionally settled man of good moral character.",42,Bengali,"Ghaziabad, Uttar Pradesh, India",,MNC,5ft,mumf239739,Hindu
"I M MSC .B.ED WORKING IN PRIVATE SCHOOL.I LIKE MUSIC N TRAVELING ,GARDENING IS MY HOBBY. I BELONG TOO EDUCATED FAMILY.MY CLOSE RELATIVES SETTELED IN DELHI.",42,,,,Private Sector,5ft 5in,sweety123_3,Hindu
"I am Christian and would seek form a christian partner, preferably Roman Catholic. I am in USA for the last 17 years and am a citizen and planning to spend rest of my life here.",42,Others,"Chicago, Illinois",,Private Sector,4ft 11in,illf156049,Christian
"I am intelligent, attractive, and friendly, really a simple person who loves to read good books, cook and eat delicious food, travel to far-off places, etc.",42,,"Delhi, Delhi, India",,Others,5ft 4in,ranimukherji,Hindu
"Hello, I am in teaching profession. Done B.Sc, B.Ed. & D pharma and belongs to a small, simple, well educated middle class family. I am looking for a Sincere, loving, simple and qualified life partner. Preferably bachelor. My dad is a doctor, mother is no more and have a younger sister in medical profession.",42,Khatri,"Amritsar, Punjab, India",,Private Sector,5ft 6in,sk_asr_1,Hindu
I have completed my law degree at Poona University. I am a Panel Advocate of United India Insurance Co. Ltd. and handling Motor Accident cases. I am doing the investigator work of that company. I am the member of Hum Memorial Chruch. I have completed the Diploma in Computer Application Course. I have also done the English and Marathi speed class.,42,Protestant,"Ahmednagar, Maharashtra, India",,Others,5ft 2in,swapna_amolik2007_in,Christian
"Designated as Senior Manager in the Store Planning Department of a leading retail organisation in India. Live with an extended joint family with my fathers brothers and their family. I have a younger brother who is into the family business. 

Besides enjoying the work I do, I also enjoy reading books, watching movies and listening to music. I like travelling.",42,Vaishnav,"Mumbai, Maharashtra, India",,Private Sector,5ft 3in,nimisha_magdani_in,Hindu
"Solicit serious (I mean the intent not the demeanor) proposals only. I am a sensitive and caring person looking for a co traveler in this journey called life who fills up this journey with love, lots n lots of laughter, care, pampering, foremost would be his ability to converse with me and sustain my interest which ought to be there as he would be my travel companion. I love traveling, exploring new places and people, listening to music. I live each moment as it comes and don't believe in planning life. I am honest and appreciate honesty, I hate deceit. Looking for a friend and companion in the true sense. I am looking for an Evolved and a successful Man who has been able to achieve a good mix of spirituality and Materialism in life and both are important.",42,Brahmin,"Delhi, Delhi, India",,MNC,5ft 3in,ekta_sudan_1971,Hindu
"I am hardworking and sincere girl staying with my sister (no parents). 
",42,,"Mumbai, Maharashtra, India",,Private Sector,5ft 2in,tanushree_14,Hindu
"HI, I AM DEEPALI. I am an easy going, fun loving person who believes in positive attitude, love traveling, reading, sports and being health-freak like to do workouts, aerobics. I come from highly educated and reputed family. I have traditional as well as modern outlook. Looking for a life partner who is educated and down to earth, would be like a friend cum companion.",42,Brahmin,"Pune, Maharashtra, India",Other Business Institute,Private Sector,5ft 3in,punf1329473,Hindu
"Hi i Urmeela. I am a commerce graduate. I live in my parents & brother, sister. My father is farmer. Mother is housewife. Brother is computer engineer. His own office. He is a married.  My hobbies is reading, watching tv, travelling, shopping.",42,Maratha,"Kolhapur, Maharashtra, India",,,5ft 1in,kolf998939,Hindu
"She is  very simple in looking & talking.We are searching a suitable person for her.He must be a Never-Married, hard worker,loyal & from North-East and Govt employ.we r searching from Assam,Meghalaya etc etc. our parent passed away. ",42,Kayastha,"Tura, Meghalaya, India",,,5ft 3in,turf1070966,Hindu
"Am a simple girl at heart, brought up in modern society yet love some things the old fashioned way especially being secure and committed in a relationship. Spiritually inclined , closely connected to Nature - prefer a slowpaced basic lifestyle.                                      Not into clubbing and partying  and socialising - No gossipping and idle chatter for me ...
Enjoy nature walks,picnics,the great outdoors,organic pure vegetarian food.",42,,"Mumbai, Maharashtra, India",,,5ft 3in,mumf1003369,Spiritual
"Hello, I am Deaf. I am just looking for someone to share my life with. I can speak and follow most of the conversations by lip-reading and Indian Sign Language. I am a very easy going person, but also can be quite firm when i need to. ",42,Agarwal,"Mumbai, Maharashtra, India",,,5ft 2in,tmc2c5773,Hindu
Am a person who live life with fun and happiness; people say I fill my surrounding with joy and happiness. I respect moral values but hate moral policing. I love to visit new places and cannot stop myself to experiment new and happening things,42,Rajput,"Jammu, Jammu and Kashmir, India",,Others,5ft 9in,SMF1524322,Hindu
"A very simple and kindhearted person, believes in simplicity. Love cooking, music, etc. Love passionate and hard working type of person. A very straight forward person.",42,Sikh - Arora,"Ahmedabad, Gujarat, India",Kanpur University,Not Working,5ft 6in,SMF1588102,Sikh
" ""... I am writing on behalf of my sister. Marriage broken within 4-5 months and Annulled by Court. She is very well educated, did bachelors in Political Science from Miranda House and LLB from Delhi University. She later on did her Fashion designing course and was running her own boutique shop in Delhi. She also did her computer course from NIIT. Has good knowledge of computer and MS office. She knows driving and drives independently. ..."" ",42,Jatav,"Delhi, Delhi, India",,,5ft 3in,delf1238572,Hindu
"Hi there,
          She loves to leave a simple life.she belives in family values.she likes to listen soft music,she also likes watching movies.she is a joly person.",42,Lohana,,,MNC,5ft 4in,mumf994652,Hindu
I am a fun loving lady...who is also serious about the hardships of the modern world.I woluld like to have a successful and happy marriage.My patner must be my best friend with whom I shall not have any inhibitions.I am cosmoploitan and broad minded.I like to travel and discover the geographical and historical places.I want my patner to share the same interests. Lets be friends first and see if we do get along.,42,Kayastha,"Kolkata, West Bengal, India",,Others,5ft 2in,akansa808,Hindu
"My daughter is smart, well qualified and attractive. She is a post graduate likes reading, animals and trekking. .....................................",42,Rajput,,,,5ft 4in,mysf1145277,Hindu
"I have completed my basic education in a convent school in the Gulf. I have a graduate and masters degree in commerce from Pune University. I have completed Cost Accountancy course of ICWAI (similar to CA) & I'm an associate member of the Institute. 
I'm a cost & management accountant, currently working as Manager Finance in an IT Company. Although work takes up most of my time, I enjoy with friends and family over the weekend. My interests including reading, watching movies, dramas, painting, sketching, listening to music, attending concerts, traveling, picnics etc. I take up whatever opportunity comes my way to explore new places, party with friends, or take a vacation etc. I have also traveled to couple of places abroad on vacation.
I am not very conservative in my approach to life.  ",42,Brahmin - Saraswat,"Pune, Maharashtra, India",,Private Sector,5ft 2in,punf1044613,Hindu
"My sister is a simple, kindhearted, intelligent girl with high moral values. Looking for a groom who is nice, honest, family-oriented and well educated. She is a mix of traditional and modern values. She is religious and God fearing. She seeks similar qualities in her partner.",42,Brahmin - Saraswat,"Gurgaon, Haryana, India",Pondicherry University,MNC,5ft 5in,hosf1357811,Hindu
"Am a homely, self-reliant and independent woman. I have been brought up in a very good culture. I have varied hobbies from Rangoli making, cooking, to learning computers and keep myself fit and healthy.",42,Brahmin Kanada Madhva,"Bangalore, Karnataka, India",,,5ft 5in,savithaa_g,Hindu
i m a fashion textile designer running a good handsome salary with a private company in kolkata. ,42,Karana,"Kolkata, West Bengal, India",,Private Sector,5ft 4in,kolf1073021,Hindu
"Good looking, ,intelligent ,honest and straight forward.Verymuch belief in GOD. Expecting a good life partner who understand me in all aspects and able to give the good companianship ",42,Scheduled Caste,"Bangalore, Karnataka, India",,Public Sector,5ft 3in,banf550846,Hindu
"She is simpal girl & behavior is Cultured,Family and perfect in homely works and believing in family values. Her nature is charming.By nature she is a hard working, caring and affectionate . An ardent believer in moral and humane values.
Her brother is director in Digi cable.Her sister in law is member of municipal council. She have two beautiful nieces.",42,Lohana,"Jabalpur, Madhya Pradesh, India",Punjab Technical University,Private Sector,5ft 3in,parul_38,Hindu
"I am an easy going-friendly-lovable and a down to earth person.I like to socialise,read and watch tv.Presently am working with an entertainment comapny ,heading a finance & Accounts department.I believe in family and value the same.Thats the reason am on this website.I am looking for a life partner who can be my frnd as well.He shd be an educated guy.Values : shd be loving,caring , with lots of passion towards life and enjoys the wonderful life.He shd have a good sense of humour(i love  smiling and laughing a lot). A partner who knows me and values being with me. A person who can be my strength and weakness to...:-)",42,,,,Private Sector,,soulmate_sons,Jain
"I am a practicing physiotherapist. I had worked in Muscat for 5 years. I have a married elder sister and I stay with my parents. I am sincere, hard working and would like to continue to work after marriage.  ",42,Brahmin - Iyer,"Vadodara, Gujarat, India",,,5ft 8in,gujf537505,Hindu
"My daughter is a very loving & affectionate person & has a very pleasing & a fun loving personality. A blend of religious and modern thoughts, She is a complete family person. After completing her graduation she has kept herself busy with teaching, as a teacher & is really fond of the profession. we are a family of seven members including my wife, my son, my daughter in law & my 2 grandsons. Our roots belong to Peshawar from where all our relatives migrated & settled in & around Delhi. Our family tree is a close knit structure where all relatives are well educated & well placed. Since 1971, we run an independent business in petroleum & industrial chemicals. We are distributor for IOC ltd and DuPont India and have offices at Delhi & Aligarh.",42,Punjabi,"Delhi, Delhi, India",,Private Sector,5ft 5in,dbisp1282,Hindu
"As-Salaam-Alaikum,

I believe a healthy marital relationship is based upon Fear of ALLAH, mutual trust and simplicity. What I look for in a partner is the above. We all have our goods and not so good sides but a little bit of understanding and tolerance goes into building a happy & strong marriage. I understand the give and take premise too and that starts within oneself.

I am looking for a good Muslim partner; not someone who just wants a wife for a particular reason. Basically, an educated (not necessarily academically), self sufficient individual with a respectable family background.",42,Sunni,"Virginia, Minnesota",,Others,5ft 6in,71seema_in,Muslim
"Hi, it can be misleading to summarize one's personality in words. Different people bring out varied aspects in different people. 

Acedemic Qualifications
M. Sc and PH. D in Chemistry

Personal Attributes : I would describe myself as friendly and pleasing personality with good sense of humor. I am responsible, down to earth and a fun loving person. I value correct balance between traditional and modern values. 
I enjoy spending time with nature, visiting places with beautiful sights, watching movies, music and reading. 

My preferred Partner : I can say that I am basically looking for someone with whom I can communicate and be comfortable as a good friend. Someone who has regard for family values, a modern outlook, down to earth and good sense of humor. Caste no bar",42,,,,Public Sector,5ft 4in,raguja18,Hindu
"I AM TALL, BEAUTIFUL, FAIR COMPLEXION, SLIM BRAHMIN GIRL, HEIGHT 5-5"" WT. 55KG .  WORKING AS A SALES COORDINATOR IN ONE OF A LEADING AUTOMOBILE COMPANY SITUTATED IN DILSHAD GARDEN.  MY FATHER IS WORKING IN A REPUTED AUTOMOBILE COMPANY.  MOTHER IS A HOUSE WIFE. BROTHER IN LAW WORKING AS A AREA MANAGER IN ONE OF MNC",42,Brahmin,,,Private Sector,5ft 6in,vwasdev_in,Hindu
"We are looking for a good human being,who should be educated,jovial,atleast a kayastha down to earth & friendly in nature.He should belong from a cultured family.Govt.job holder or MNC will be preferred.",42,Kayastha,"Patna, Bihar, India",Other Law Institute,Private Sector,5ft 1in,patf1197534,Hindu
"She is postgraduate  she has completed MA in sociology , polytechnic diplom in fashion designing ,   taken diploma in   cretive       writing ,jornalism,stage science.she is poetetss,love pets good oil painter.cooking all indian food and western food is her hoby. she is very innocent girl .",42,Sahu,"Lucknow, Uttar Pradesh, India",,,5ft 4in,lucf927275,Hindu
"Easy going, fun loving, . Loves traveling, swimming, plays Badminton, spends a lot of time with friends, loves watching movies, reads Management and fiction. Acquarian(Aangi Raasa - Gothra, Star - Revathi), Mother tongue kannada- Mangalorean. Born in Cochin, Educated in Gujarat, Pune & Bangalore. Worked in Mumbai, Chennai and currently in Bangalore.Globe trotting - travelled to U.K, Japan, Australia, Newzealand, Singapore and Mouritius",42,Brahmin,"Bangalore, Karnataka, India",,MNC,5ft 9in,Sapna1971_in,Hindu
"She has 4 sisters, 2 are in u.s.a. She is doing job in u.s.a.",42,Agarwal,Ohio,"Barkatullah University, Bhopal",Private Sector,5ft 2in,ohif181150,Hindu
"Looking for an understanding, loving and trustworthy partner... who would like to share his life with me.  Let's get to know each other and go from there??",42,,,,MNC,5ft 1in,jaanvi,Hindu
"My sister is a person who looks for a practical end result which is tangible and long lasting. High flying, fanciful notions don't interest her. She is placid, reliable, consistent, she may look easy going and laid back but she likes to be in control in her life and relationships. 
She much prefer a routine which she can see stretching ahead. A marathon runner not a sprinter, she has staying power and the will to see projects through to the end. A settled home and family life is very important to her emotional happiness. She is protective to the point of possessiveness of those close and will defend them vigorously against anyone who threatens them in any way. Nothing pleases her more than a house full of the extended family and close friends, enjoying themselves. 

Loyalty is a strong factor in her thinking where life partners are concerned. Once established in a long running relationship she is happy for it to continue on an even course. Beauty, elegance and indulgence make her purr with pleasure. An perfectionist about prospective partners, like them to be well turned out. 
 A nature lover, she adore the wide open spaces, she also appreciate the cultural highlights which big cities offer. Places close to normal residence make her feel at ease so she often doesn't have to travel far to relax. 

At home a mix of elegance and pleasurable comfort is the look she aims for. Though she'll never let design get in the way of practicality. 
For her, home needs to be functional as well as beautiful.",42,Maratha,"Mumbai, Maharashtra, India",,,5ft 4in,03_swa,Hindu
"Hi, I'm basically a very simple  person. I like to travel and I've done a bit thus far. I'm currently teaching. I just hope to find someone who is caring, understanding, loving and God-fearing.....with God's grace!!  ",42,Catholic,Others,,,5ft 1in,othf1156267,Christian
