aboutText,age,caste,city,college,employedIn,height,profileID,religion
Our daughter is straight forward and God fearing. ,35,Digambar,"Chennai, Tamil Nadu, India",Chennai University,Not Working,5ft 5in,SMF1751297,Jain
"We are three sibling and she is the youngest. I am settled in Mumbai for the last 17 years. I work as a media professional. My brother who is an income tax lawyer is settled in our home town Moradabad. Our father expired seven years back. Right now my sister is assisting me in my work. She was working with Delhi Metro Corporation, however she was transferred to Chennai and she submitted her resignation, Earlier she was working as a merchandiser with a garment firm. Though she has been working for quite sometime now, she is also proficient in household work. We are an educated and religious family and are looking for alliance from an educated and religious family, preferably for someone settled in Mumbai, Delhi or western UP.",35,Sunni,"Mumbai, Maharashtra, India",,MNC,5ft,SMF1748859,Muslim
"A simple lady by nature though have some what modern approach towards life; was working previously; being the alone girl child in the family has shouldered the entire responsibility of the family for had lost our mother 10 years back, believes ""Deen and Duniya"" are the pillars equally to be climb together. A strongly believer in the ""Institution of Marriage""; a believer in religion, family traditions and culture, as these things reflect our attributes and teachings; and are the same to be granted to our future generation. A person bearing a compassionate soft heart; i.e. love for her family and friends, believes in simple life, such as companionship, holding hands, watching movies, etc. Her interests and hobbies: Herself is blessed with Creative acknowledgement, creates new things while thinking as have a variety of skills for do a lot of artistic work; like interior decorations, gardening for enjoy nature, like listening soothing music, watching movies at home; specially the romantics, comedy, some of horrors, documentaries and simple movies. Like to go for a walk in the evenings, enjoy having fun with kids as love kids a lot. Our family consists of four members, myself her elder brother, I was working as finance manager in Muscat; Oman, currently busy in planning for business, recently got married and my wife is a doctor (M.D), my father has retired as production supervisor, lost our mother in 2003. Herself has completed her bachelors from Mumbai university and Masters from Pune University.",35,Sunni,"Navi Mumbai, Maharashtra, India",,Not Working,5ft 4in,SMF1741135,Muslim
I am simple living girl. I am straight forward and hope the same from my life partner. I expect my partner as the good human being with high thinking man. I believe in family values and used to of following them. I would like to remain working after marriage rest depends upon circumstances. ,35,Mallah,"Gwalior, Madhya Pradesh, India",,Private Sector,5ft 3in,SMF1740159,Hindu
"I am posted in Railways as Junior Engineer. Am basically simple, honest and friendly person. I am looking for someone simple, caring, well educated and preferably settled in Lucknow.",35,Kharwar,"Lucknow, Uttar Pradesh, India",,Central Government,5ft 4in,SMF1737835,Hindu
Simple and caring girl from a well cultured upper middle class family.,35,Brahmin - Kanyakubj,"Pune, Maharashtra, India",,Not Working,5ft 4in,SMF1735937,Hindu
"I am god fearing, we all in our family strictly follow daily prayers bible reading, and never miss Sunday church. ",35,Others,"Korba, Chhattisgarh, India",,Not Working,5ft 2in,SMF1734334,Christian
"God fearing, caring, loving, respectful, homely, values family and understanding.",35,Others,"Nagpur, Maharashtra, India",,Not Working,5ft 3in,SMF1729250,Christian
"I am Shinta from Indonesia, wish to find my right partner here.",35,Protestant,,,MNC,5ft 2in,SMF1723322,Christian
"Hello, i am Asra Syed. I have completed my Fashion Designing, Computer Programming, Montessori training and ECCED(Early Childhood Care and Education). I am currently working as a Teacher. Residing in Bandra West. I am confident, witty, helpful, dedicated, good cook, fun loving. Values: honest, religious, family oriented, loving and caring. Motto in life: live and let live. Hobbies: painting, cooking, watching movies listening to music. Favorite sports: cricket.
i want my partner to be tall, god fearing family oriented, educated, well settled, fun loving, should respect women, honest. ",35,Sunni,"Mumbai, Maharashtra, India",,Private Sector,5ft 8in,SMF1719213,Muslim
"I belong to a respectable family & brought up to uphold traditional values. I am well educated, intelligent, mature, jovial and independent. Sometime I am very emotional & sensitive. I believe in simplicity and innocence, precisely a blend of modernity and traditionalism. I have a very positive attitude and optimistic approach.",35,Rajput,"Delhi, Delhi, India","ICFAI, Hyderabad",Private Sector,5ft 3in,SMF1713629,Hindu
"completed MA, B.ed and presently working as an Art teacher in reputed private school in Ludhiana. We are 6 members. 2 elder sisters married and settled. 1 younger brother unmarried working in merchant navy as an engineer, father retired from govt. job as an architect and mother housewife. Am a fun loving person and expects the same from my partner.
",35,Sikh - Tonk Kshatriya,"Ludhiana, Punjab, India",Punjab University,Private Sector,5ft 1in,SMF1718907,Sikh
"My sister is very simple, shy and sober person. She has done MA in Hindi Literature. Her hobbies are listening to music and yoga.",35,OBC/Barber/Naayee,"Pune, Maharashtra, India",Nagpur University,Not Working,5ft 2in,SMF1719369,Hindu
"I am a person who believes in making relationship work and who is sincere in efforts. I take life as it comes and don't believe in taking unnecessary tensions.
I like reading, listening to music, outdoors and chatting up with friends. I am looking for a settled person who is professionally doing well and who has a wide approach to life. ",35,Brahmin,"Mumbai, Maharashtra, India",Mumbai University,MNC,5ft,SMF1719064,Hindu
"She is simple and has fun filled lifestyle. She is straight forward, down to earth and career conscious independent person. She is described as a cool person by most of her friends who likes to socialize with people. She is working in a MNC and enjoys her job. 
",35,Rajput,"Bangalore, Karnataka, India",,MNC,5ft 2in,SMF1757113,Hindu
I am an idealistic person with a unique blend of traditional and modern outlook.,35,Brahmin,"Agra, Uttar Pradesh, India",Agra University,Private Sector,5ft 4in,SMF1710836,Hindu
I am very caring and understanding girl.,35,Kayastha,"Ghaziabad, Uttar Pradesh, India",Kanpur University,Private Sector,5ft,SMF1708518,Hindu
My self Madhulika Gupta. I am a simple girl with lots of love care and respect for people.Basically i am a b.com graduate but have done fashion designing and did job for 10yrs in garment industry. Now i am not working.Want to settle down once again in life after marrying the right person.,35,Baniya,"Faridabad, Haryana, India",,Not Working,5ft 3in,SMF1705940,Hindu
"I am a simple girl, honest as well as understanding in nature. ",35,Catholic,"Pune, Maharashtra, India",N. Wadia College,Private Sector,5ft 3in,SMF1704713,Christian
"I am a responsible, self confident and fun loving person who has a good set of values.",35,Kshatriya,"Kolkata, West Bengal, India","Calicut University, Kerala",Private Sector,5ft 1in,SMF1701973,Hindu
I am down to earth and confident about myself. I am a family person and belongs to a close knit family. ,35,Rajput,"Kalyan, Maharashtra, India","Other College, Mumbai University",Others,5ft,SMF1701852,Hindu
"I am putting up this profile on behalf of my sister. She has done her Masters. Her mother is a homemaker, father is employed, and has 2 brothers and 2 sisters. ",35,Sonar,"Ambikapur, Chhattisgarh, India",,Not Working,5ft 1in,SMF1702543,Hindu
i am komila singh .i want a loving nature husband and will supported to me and my family .,35,Protestant,"Delhi, Delhi, India",,State Government,5ft 3in,SMF1749151,Christian
She is simple and quite caring person. Had been working in Bangalore as a team lead. Now looking for an opportunity at Trivandrum.,35,Orthodox,"Thiruvananthapuram , Kerala, India",,Not Working,5ft 2in,SMF1752064,Christian
I'm very simple honest and caring woman.,35,Sunni,,,State Government,5ft 4in,SMF1755582,Muslim
"I'm 35 years, 5'5"" tall, Sinhala, Christian. I'm working as an executive in a private firm. I'm down to earth, simple, religious, family oriented and good looking. I got my divorce after unsuccessful brief marriage. Am looking for a educated, straight forward, kindhearted, understanding & loving caring person. 

",35,Others,,,Private Sector,5ft 5in,SMF1755184,Christian
"Hi, Im born n brought up in Mumbai. I'm a science graduate, with simple thoughts and am down to earth with good family values. ",35,,"Navi Mumbai, Maharashtra, India",,Private Sector,5ft 3in,SMF1701802,Hindu
"Hi, i am looking someone for sister. Someone who can take the things positively and live life happily. Educated person with good understanding and having values of humanity.",35,Scheduled Caste,"Delhi, Delhi, India",Lucknow University,Private Sector,5ft 2in,SMF1700370,Hindu
"My sister is simple, affectionate and open-minded. She is responsible and jovial. Likes music and reading. ",35,Lingayath,"Bangalore, Karnataka, India",,Central Government,5ft,SMF1743961,Hindu
"I AM A DEGREE HOLDER FROM ASSAM UNIVERSITY LOCATED AT SILCHAR, ASSAM. I ALSO COMPLETED MBA LATER. MY FATHER IS A RETIRED CENTRAL GOVT. CLASS I OFFICER. MY MOTHER IS A HOUSE WIFE. I HAVE ONLY ONE YOUNGER SISTER, WHO IS A COMPUTER FACULTY IN REPUTED ENGLISH MEDIUM SCHOOL AT KOLKATA.",35,Brahmin,"Kolkata, West Bengal, India",,MNC,5ft 5in,SMF1695303,Hindu
"Antara is a very intelligent, beautiful and down to earth girl. She has deep faith in God and traditional value.",35,Kayastha,"Varanasi, Uttar Pradesh, India",Others,Not Working,5ft 4in,SMF1708639,Hindu
"I am fun loving, romantic person, a single child of father. Love to travel, enjoy the every movement of life. Searching for a compatible person who will be with me at every stage of life. ",35,,"Nagpur, Maharashtra, India",Indira Gandhi National Open University (IGNOU),Private Sector,5ft 3in,SMF1693963,Buddhist
"I am a happy go lucky go girl. Like to listen music, watching movies, reading, cooking, meditation. Decorating home and travelling specially long drives. Hate double standard in people.",35,Brahmin,"Gurgaon, Haryana, India",Indira Gandhi National Open University (IGNOU),Private Sector,5ft 3in,SMF1724365,Hindu
"Very Simple person, caring and understanding.",35,Others,"Kuala Lumpur, Kuala Lumpur",Other Diploma Institute,Private Sector,5ft 3in,SMF1711020,Christian
"Am simple, polite, god fearing, hard working, love to be with family and friends.",35,Protestant,"Chennai, Tamil Nadu, India",,Not Working,5ft 3in,SMF1743665,Christian
"Pretty, honest, intelligent, caring, affectionate, soft spoken homely individual. Looking for an educated, established, never married person within 34-40.",35,Brahmin,"Des Moines, Washington",,Others,5ft 5in,SMF1737997,Hindu
"Hi, This is urmila, am a optimistic person with lots of hard work, trustworthy and above all dedicated in whatever I do.",35,,"Mumbai, Maharashtra, India",,Others,6ft,SMF1750407,Hindu
"Hi, I am simple yet a cheerful person. Likes to travel and spending time with my family. I believe that whatever happens in life is happens for our best. I am looking for a life partner who should be caring, sensitive and a father figure for my child.
 ",35,Sindhi-Larkana,"Gurgaon, Haryana, India",Delhi University,MNC,5ft,SMF1688720,Hindu
"She has done her graduation in Electronics and Telecommunication Engineering and MBA in supply chain operations Management. She is presently working with Greaves as Assistant Manager in Strategy and Sourcing. She is a beautiful, hard-working & competitive girl, a creative thinker with a very proactive approach towards Life. ",35,Kayastha,"Kolkata, West Bengal, India",,Private Sector,5ft 4in,SMF1736169,Hindu
"GOOD LOOKING, CONFIDENT, PROGRESSIVE THINKING WHO LOVES AND CARE FOR FAMILY VALUE. ",35,Brahmin,"Mumbai, Maharashtra, India","Other College, Mumbai University",MNC,5ft 5in,SMF1686178,Hindu
"She is simple, decent and religious girl. She is the only daughter. She is tall and good looking. Likes cooking, reading books and watching television. She is well cultured person having good manners.",35,Sunni,"Gorakhpur, Uttar Pradesh, India",Other General University,Not Working,5ft 5in,SMF1682955,Muslim
"She is very loving and caring person and loves reading both fictions and classics. She has received her basic education in convent school at Patna and had been a brilliant student through out. Being the eldest amongst her three sisters, she takes utmost care of her sisters.",35,Vishwakarma,"Delhi, Delhi, India",St. Stephens College,Central Government,5ft 5in,SMM1680009,Hindu
"I belong to simple middle class family. Looking for a teetotaler and without any issue. I have completed my Bachelors in Science. I am currently working as a Banking Professional in a Class I Officer Cadre in a Nationalized Bank. I have minor Hearing Loss, due to which i use HEARING AID and can talk and speak like any other person. Studied in normal school and college.",35,,"Delhi, Delhi, India",Delhi University,Public Sector,5ft,SMF1677920,Hindu
"I am a very positive and down to earth person. Born and brought in Mumbai. My father is from Dausa(Rajasthan near Jaipur), however settled in Mumbai since past 37 years.",35,Brahmin,"Mumbai, Maharashtra, India",Mumbai University,Private Sector,5ft 4in,SMF1687581,Hindu
"Caring, Down-to-earth, Honest, Hospitable, Simple, Sensitive, Upholds traditional Indian family values, Vegetarian, Devotional and Gregarious. Looking for a suitable match.",35,Kayastha,"Faridabad, Haryana, India",,Private Sector,5ft 2in,SMF1674754,Hindu
"A bit humorous, a bit serious kind of a girl. Believe in principle of live and let live. ",35,,"Mumbai, Maharashtra, India",,Central Government,5ft 1in,SMF1739806,Hindu
"I am simple person having optimist outlook towards life. Belongs to a cultural and educated family. I have a elder brother and an younger sister. Schooling and college from Assam. Employed in Private firm in Admin Profile. Am looking for a partner who is intelligent, caring, understanding, down to earth, professionally qualified and belongs to cultural family. ",35,Gupta,"Tezpur, Assam, India",,Private Sector,5ft 2in,SMF1669305,Hindu
"I strongly believe in family values and respect for elders. No nonsense person by nature. Strong believer of God and looking for a person who understands me, shares with me his desires, expectations and mutual respect for each other.",35,Khatri,"Delhi, Delhi, India",,Private Sector,5ft 4in,SMF1668598,Hindu
My sister is educated from convent school & college from Sophia college. Moderate & humble girl with good social values.,35,Brahmin,"Ajmer, Rajasthan, India",,Private Sector,5ft 9in,SMF1735619,Hindu
"Hi, am Geetanjali likes cooking, watching movies, exploring new places and driving. Am vegetarian, having work experience of 12yrs in Financial sector. Presently, am into the business of Tupperware and side by side looking for the good job.",35,Khatri,"Rest of Delhi, Delhi, India","Annamalai University, Tamil Nadu",Private Sector,5ft 5in,SMF1661947,Hindu
"She is highly spiritual, a very good leader, motivator, vedic chanter, loving, caring, responsible and a social worker. ",35,Teli,"Cuttack, Orissa, India",,Private Sector,5ft 3in,SMF1701822,Hindu
"I'm a down to earth person, looking for a partner who will be my best friend and well wisher ",35,Pillai,"Shah Alam, Selangor",,Private Sector,5ft 4in,SMF1684513,Hindu
"She is a simple and down to earth girl. Witty, beautiful, charming, sporty, friendly are a few words that describe her. ",35,Brahmin - Saraswat,"Delhi, Delhi, India",,Private Sector,5ft 1in,SMF1734249,Hindu
"My friends describe me as a very simple, fun loving and jovial person. ",35,Shewetamber,"Mumbai, Maharashtra, India",,Private Sector,5ft 5in,SMF1714318,Jain
I am simple and straight forward person. I am working as an Asst Professor in central govt. institute and permanently settled in Delhi. ,35,Khatri,"Delhi, Delhi, India",,Central Government,5ft 3in,SMF1713176,Hindu
"I am a simple, homely girl living with my mother and sibling. Though not very ambitious and career oriented.",35,Khatri,"Bhavnagar, Gujarat, India",,Not Working,5ft 4in,SMF1708613,Hindu
"Listening to semi classical music, photography walking and love nature. ",35,Thigala,"Mysore, Karnataka, India",,Private Sector,5ft 5in,SMF1729110,Hindu
"Belongs to an upper middle class, well educated family residing in Delhi. She is slim, smart, simple and family oriented person. Currently, working in MNC as a Process developer. She likes playing tennis, watching movies and dancing.",35,Kori,"Delhi, Delhi, India","ICFAI, Hyderabad",Private Sector,5ft 3in,SMF1651190,Hindu
"I am a simple, homemaker with strong family values. Living with my daughter who is six years of old, my parents and brother. I am looking for a life partner who understands the importance of family and willing to accept me and my daughter.",35,Brahmin,"Agra, Uttar Pradesh, India",Agra University,Not Working,5ft 11in,SMF1669200,Hindu
I am currently working with multinational company as a domain consultant and have done my Masters from reputed college.,35,,"Bangalore, Karnataka, India",,MNC,6ft 1in,SMF1729623,Others
"I am simple and understanding person. Looking for someone who is understanding, know family values and respects one and all. I like to listen all kinds of music depends upon time. I like to travel, (exploring places) and reading books.",35,Kapu,"Kurnool, Andhra Pradesh, India","Sri Venkateswara University, Andhra Pradesh",Private Sector,5ft 5in,SMF1653992,Hindu
"My sister is a religious, God fearing person. She is friendly and is always ready to help people. ",35,Sunni,"Hyderabad, Andhra Pradesh, India",Other General University,Not Working,5ft 5in,SMF1720591,Muslim
"I am simple, smart, jovial person, working and independent woman. I strongly believe in family values and like to maintain a balance between traditional values and modern outlook. I am looking for a person who is understanding, who has positive outlook towards life, who can be more like a friend and easy going person. 
",35,Brahmin - Saraswat,"Pune, Maharashtra, India",,Private Sector,5ft 7in,SMF1708390,Hindu
I am a simple girl. I am a divorcee with a daughter of ten years staying with me and am too staying with my parents,35,Brahmin - Saraswat,"Panjim, Goa, India",Goa University,Private Sector,5ft 7in,SMF1644251,Hindu
"Like Travelling, Visiting Temples, Interested to work forever, My hobbies is Poem Writing, Reading, etc.",35,Brahmin - Iyengar,"Bangalore, Karnataka, India",Karanataka University,Private Sector,5ft 2in,SMF1708312,Hindu
"My Sister Geeta is very sweet, simple spontaneous & extrovert girl and by profession she is a teacher & currently pursuing JBT from MP University.",35,Kumaoni,"Delhi, Delhi, India","Delhi College of Engineering, Delhi University",Private Sector,5ft 4in,SMF1668634,Hindu
I am an understanding person with a positive disposition.,35,Khatri,"Kolkata, West Bengal, India",Other Engineering Institute,Public Sector,5ft,SMF1706318,Hindu
"My Daughter was working in Delhi until Jan 2012 in the BPO Industry. She has worked for 9 years and held the position of an Assistant Manager. I had been in Abu Dhabi, UAE for 33 years as a Bank Manager. Currently in Ajmer, Rajasthan. Dealing in painte and chemicals, Asian Paints. My wife was handling the garment business for 12 years in Abu dhabI. Currently handling a mini supermarket (grocery shop). My daughter doesn't prefer NRI's. She would prefer a working individual settled in India. We are a middle class family. ",35,Bhatia Sindhi,"Ajmer, Rajasthan, India","ICFAI, Other Cities",Not Working,5ft 3in,SMF1701386,Hindu
"We are a small family belongs to Himachal Pradesh. My family members consist of Father, Brother, Sister-in-law and nephew and Elder sister who is married and settled in Chandigarh.  I am an MBA in Human Resources from IGNOU and a Masters in Public Administration from Himachal Pradesh University.
",35,Prajapati,"Delhi, Delhi, India",Indira Gandhi National Open University (IGNOU),Public Sector,5ft 2in,SMF1634564,Hindu
I am a caring girl with family values and looking for a loyal life partner.,35,Agarwal,"Noida, Uttar Pradesh, India",Lucknow University,MNC,5ft 3in,SMF1711122,Hindu
"I am a fun loving person who loves to travel, see new places and bond with people. I love to see a little bit of happiness on everybody's face that I meet (at least a smile) and would love to go the extra mile for that. I like Reading and sports. I like cooking but know only some basic stuff. I believe my smile is my biggest asset and I would like to use it to bring a smile on everybody's face. My passion is my 3 years old son. I like dancing, watching movies and believe that music soothes. I am a simple person with desires that every girl has and who believes life is beautiful. ",35,Jain-Others,"Mumbai, Maharashtra, India",Other Engineering Institute,Private Sector,5ft 1in,SMF1706806,Jain
"Anamika is a successful entrepreneur, has been managing her firm Koshikaa Interiors for more than 10 years now. A very fun loving person, kind by heart, has been involved in a fair share of philanthropic activities. Even though she is absorbed in her professional life, she is very good at maintaining a healthy work life balance. Apart from work she likes to travel to new places, take part in outdoor activities and loves driving. She is looking for a match who can understand her in terms of her values.",35,Kayastha,"Indore, Madhya Pradesh, India",,Others,5ft,SMF1660024,Hindu
"My sister is a family oriented girl who understands and believe in Indian value system, traditions and social values.",35,Gupta,"Bhopal, Madhya Pradesh, India","Barkatullah University, Bhopal",State Government,5ft 3in,SMF1700632,Hindu
"We are looking for an educated and decent boy for our family-oriented daughter. Our daughter did her MS in USA and worked there for several years before returning to India. She is currently living with us in Delhi. We are looking for a family-oriented, yet progressive boy. Ours is a small family that is close-knit with respect for Indian traditions",35,Brahmin - Gaur,"Rest of Delhi, Delhi, India",,Others,5ft 2in,SMF1703135,Hindu
"HONESTY, SIMPLICITY IN LIVING AND OPTIMIST TOWARDS LIFE. ",35,,,,Others,5ft 8in,SMF1696054,Muslim
"I am a simple, God-fearing person, looking for a responsible, God-fearing and caring partner.",35,Sunni,"Thane, Maharashtra, India",,Not Working,5ft 2in,SMF1721752,Muslim
"I am well educated, intelligent, loving, understanding and have a good sense of humor. ",35,,"Ahmedabad, Gujarat, India",,Others,5ft 3in,SMF1633307,Parsi
"Simple, having good and cultured family values, down to earth person, looking for a good person with moral values and clean habits. I am a non vegetarian but having religious values like to visit temples and like to travel.",35,Menon,"Delhi, Delhi, India",,Private Sector,5ft 2in,SMF1690512,Hindu
"Simple, well educated girl from Delhi. Did her schooling from Delhi. Completed her B.Com from Delhi University. Then Did Web engineering 3 years course from Aptech arena multimedia, Delhi. Presently, she is not working.",35,Agarwal,"Delhi, Delhi, India",,Not Working,5ft 2in,SMF1629026,Hindu
"I have completed my Masters in Hindi. Currently working in a reputed public school. I am very confident, self reliant, caring and warm individual. Love cooking, Watching TV and traveling.    
",35,Khatri,"Ambala, Haryana, India",,Others,5ft 9in,SMF1689746,Hindu
"Am a simple and honest person, born and brought up in a middle class family and am rhe youngest one out of the two siblings. ",35,Protestant,"Shillong, Meghalaya, India",,Private Sector,5ft 1in,SMF1683649,Christian
"I am a practicing Lawyer based at Delhi, living with my parents at Ghaziabad. A god fearing, emotional, helpful, caring understanding, understands family values, loves profession, love kids and friendly. Want a partner with the more or less of same nature.",35,Brahmin,"Delhi, Delhi, India",,Others,5ft 3in,SMF1621650,Hindu
"We are 2 sisters and am the elder one. Am a simple, loving person who likes writing short stories and would like to continue my job post marriage.",35,Others,"Bangalore, Karnataka, India","Visveswaraiah Technological University, Karnataka",Private Sector,5ft 1in,SMF1624172,Muslim
"My sister is a combination of strong family values with a fun loving, pleasing personality. Her marriage plans were postponed due to the sudden demise of our father. ",35,Brahmin - Saraswat,"Mumbai, Maharashtra, India",,Not Working,5ft 7in,SMF1684945,Hindu
"My sister is fair, beautiful, soft spoken, caring Person. She has done B.com. She enjoys cooking and decorating house. Have respect for elders and family values.",35,Sunni,"Bangalore, Karnataka, India",,Private Sector,5ft 4in,SMF1721888,Muslim
I am from a middle class family and my father is a retired Principle. My mother is a homemaker. I need a very simple life with someone i can be very comfortable with. I want to smile and laugh with the same person for the rest of my life.,35,Telaga,"Delhi, Delhi, India","Sambalpur University, Orissa",Not Working,5ft 3in,SMF1613835,Hindu
