aboutText,age,caste,city,college,employedIn,height,profileID,religion
"Hi, I am Puja. Basically from Kolkata, n now in Mumbai. I was working as a PRO for last 2 years. And now taking rest for some change. I am fun-loving, and have friendly nature. Looking for my right life partner. ",23,Scheduled Caste,"Navi Mumbai, Maharashtra, India",Indira Gandhi National Open University (IGNOU),Others,5ft 3in,SMF1448563,Hindu
"loves music, movies. likes people with open mind. brought up from a middle class traditional family. working as a soft ware trainee engineer in HCL. completed training and awaiting for posting after allotment of project.",23,Kuruba,"Kurnool, Andhra Pradesh, India","Sri Venkateswara University, Andhra Pradesh",Private Sector,5ft 6in,SMF1569771,Hindu
"I am an open minded person who knows the limitations. Here to search my life partner. Am hardworking person from a family of professionals and looking out for a like minded person to spend life happily.
",23,Bishnoi/Vishnoi,"Delhi, Delhi, India",Delhi University,Not Working,5ft 4in,SMF1539085,Hindu
"Hello, I m a very simple cultured girl who believes in respecting elders and Indian traditional values. For me understanding and honesty is most important than anything else in a relationship and more importantly in a marriage.",23,Punjabi,,,Private Sector,5ft 4in,SMF1513620,Hindu
"Fun loving, adaptable, caring and sensitive, determined, hardworking and outgoing.	

",23,Sia,,Other General University,Not Working,5ft 3in,SMF1463517,Muslim
"Hi  i am shwetha, n ilove my family very much n i am here to find agood partner who is caring and who can understand very well...........                                                                               .",23,Lambani,"Shimoga, Karnataka, India",,,5ft 3in,shmf1361279,Hindu
"Am a person with loving heart, caring nature and one who believe in simplicity.",23,Kshatriya,"City of London, Greater London / Middlesex",London School of Business,,5ft 4in,SMF1587800,Hindu
"Am searching for a well educated, family person for my sister who is working as a Software developer. ",23,,"Etawah, Uttar Pradesh, India",Other General University,Private Sector,5ft 4in,SMF1571618,Hindu
I am a conventional girl coming from a traditional family with balanced values. I believe in almighty God. I love to enjoy the simplest joys of life & feel that the simplest things are the one's that leave an indelible impression in the mind. ,23,Digambar,"Delhi, Delhi, India",Other General University,Private Sector,5ft 3in,SMF1495502,Jain
"Love music, dance and shopping.",23,Digambar,"Delhi, Delhi, India",Kurukshetra University,Private Sector,5ft 5in,SMF1587650,Jain
"Doing 4th year in school of excellence in law B.A,B.L. Interested in carnatic music,Father working as consultant, Mother House wife,Brother doing 12 th standard Parents well settled having own house in chennai.  ",23,Brahmin - Iyer,"Chennai, Tamil Nadu, India",Other Law Institute,Others,5ft 5in,SMF1445720,Hindu
"I am a very simple and humble believe in living every moment and god fearing person. Soft hearted, well mannered and attached to my family. Have completed my masters in Finance and HR. I want a caring, humble and understanding partner who would be with me through the ups and downs of life. Looking forward to experiencing this beautiful phase of my life.",23,Protestant,"Pune, Maharashtra, India",,MNC,5ft 1in,SMF1563382,Christian
I am a cute girl. I am younger sister in my family. My hobby is to play with small children. I m very fun loving girl in my relatives.  ,23,Sunni,"Bhagalpur, Bihar, India",Patna University,Not Working,5ft 3in,SMF1455493,Muslim
Believe in living a simple life with an understanding partner and with the family and loving in-laws; he should be very innocent and caring too with whom i will never feel lonely and awkward. ,23,Sonar,"Kolkata, West Bengal, India",,Not Working,5ft 1in,SMF1437196,Hindu
She belongs to a broadminded family consisting of her Parents and she herself. To her thoughts her Parents are the most important person of her life and she wants to marry a guy who respects his parents as well as her parents as she does. She is a career oriented girl who knows how to achieve success in her professional life besides she also knows very well how to manage the household things and responsibilities. ,23,Brahmin,"Delhi, Delhi, India",Kanpur University,Private Sector,5ft 5in,SMF1574714,Hindu
"Basically we are from Dharbhanga, Bihar, but we are in West Bengal since our childhood. We are Madhesia by caste. We are looking for someone who is from the same caste and living in West Bengal.",23,Gupta,"Kolkata, West Bengal, India","Nagarjuna University, Kolkata",Not Working,5ft 7in,SMF1586067,Hindu
"Simply but stylish, modern and self dependent person. Like to drive, party, spending time with friends, etc. Hobbies include cooking, art work and chatting. Looking for a smart and handsome partner who will understand me and my needs.",23,Agarwal,"Neemuch, Madhya Pradesh, India",,Private Sector,5ft 1in,SMF1586770,Hindu
"Polite, Soft spoken, Tolerant, Considerate, Religious, Loving hygiene, Adjusting, Caring and ablend of modern & traditional values.",23,Brahmin - Dixit,"Bareilly, Uttar Pradesh, India",,MNC,5ft 4in,SMF1568071,Hindu
"She is an educated, good looking, slim, cultured and efficient in household chores. Her father is farmer.She is the youngest among four brothers and five sisters. Her eldest(self employed) and youngest brothers are civil engineers and settled in Mumbai.The other brothers are engaged in agriculture and business at village.All sisters are married. Her maternal uncle is retired professor from veterinary medical college, ranchi.",23,Brahmin - Maithil,"Motihari, Bihar, India",,,5ft,motf1259467,Hindu
I am a graduate with B. tech in computer science. Love to listen and sing songs and painting is my 1st love. I am a simple girl who loves to talk a lot and laugh. I love to spend time with  family and friends.,23,Banik,"Kolkata, West Bengal, India",Others,,5ft 2in,SMF1500169,Hindu
"I am 22 year old, height 5ft 4in. I like interacting with new people as well as making friends; like going for outings with frnds for fun; like listening music, caring animals and wild life, also surrounding, nature, cooking and love to be busy always. ",23,Maratha,"Mumbai, Maharashtra, India",Other Engineering Institute,,5ft 10in,SMF1492331,Hindu
"i m simple and straight forward......!!
i don't like liers....
I'm broadminded....now I'm pursuing b.c.a and i want to become a army officer or campus selection in company's....i like painting and horror movies",23,Rajput,"Ahmedabad, Gujarat, India",,,5ft 4in,ahef1381193,Hindu
"we are traditional, moderate, well educated, Hyderabad family, looking for a compatible match. i m the only sister of two brothers: big brother is settled in US, younger brother is in a dental school. Our dad is Govt College Principal and mom is a homemaker. i m kindhearted, family oriented and well balanced with Islamic and social values. i m sensitive, caring and adjusting and last but not least has the cutest smile. We are looking for a potential match in age range 23-28, who is well educated, good character and ready to settle down. our preference is boy and family from Hyderabad background, doesn't matter living anywhere. ",23,Sunni,"Hyderabad, Andhra Pradesh, India",Other Engineering Institute,Not Working,5ft 4in,SMF1448628,Muslim
"I am a cool kind of person, caring, positive attitude, hate violence in any form. I am a person who believes in focusing on the solution, future rather than the problem or past, love to visit new places.",23,Brahmin,,,Not Working,5ft 3in,SMF1528921,Hindu
Am a fun loving girl. Seek for the partner as well as the family where I will be treated like their daughter. ,23,Sunni,"Bangalore, Karnataka, India","Other College, Bangalore University",Private Sector,5ft 1in,SMF1569726,Muslim
"I am very simple, beautiful, slim, fair, educated with open mind.  I believe in : ""Marriages are made in heaven"" and ""Miracles do happen"".
Most of my family is in USA.",23,Punjabi,"Delhi, Delhi, India",,,5ft 5in,delf1370523,Hindu
"hi.i am a good & simple girl.i am very fair..looking very beautiful & calm.i like my mom,dad,grandma,my brother chintu.",23,Kamma,"Vishakhapatnam, Andhra Pradesh, India","Jawaharlal Nehru Technical University (JNTU), Hyderabad",MNC,5ft 11in,SMM1447916,Hindu
"She is my elder daughter. she has done B.e. with computer science; now she is preparing for government sector exams. She is good looking. Her life partner should also be handsome, caring & intelligent.",23,Brahmin - Kanyakubj,"Katni, Madhya Pradesh, India",,Private Sector,5ft 1in,katf1372414,Hindu
"My daughter is very caring and polite, and is looking for a smart soulmate. One who is caring and loving. ",23,,,ISB Hyderabad,Not Working,5ft 3in,SMF1583560,Others
"HI, I belong to nuclear family. I have done M.A. psychology (counseling) from pune. I am a simple girl with creative mind. I like to play games like volleyball, football, also I like to listen music.",23,Brahmin,"Pune, Maharashtra, India","Other College, Pune University",State Government,5ft 9in,SMM1493049,Hindu
"well looking,doctor or engineer,well settled,good character groom with liberal  well brought up family. they should treat mydaugtehr as thier daughter.",23,Reddy,"Trichy, Tamil Nadu, India",,,5ft,trif1102781,Hindu
i am simple girl with traditional view.,23,Dhiman,"Nagpur, Maharashtra, India",Nagpur University,Private Sector,5ft 8in,SMF1580759,Hindu
I am very cool going person.,23,Yadav,"Dharamasala, Himachal Pradesh, India","Kakatiya University, Andhra Pradesh",Private Sector,5ft 5in,SMF1580837,Hindu
She is very friendly and very simple girl.She is very practical in nature.She is continuing her M.A in English and will complete in 2013.She is very caring and loving girl from a traditional and cultured family.She can adjust herself in any circumstances and she is also a fun-loving girl.,23,Karana,"Cuttack, Orissa, India",,Not Working,5ft 4in,SMF1556954,Hindu
"Am a freelance artist and a teacher. I like creative people basically those belonging to my field. My hobbies are cooking and singing, apart from these i love reading books and exploring various things. ",23,Kshatriya,"Bhagalpur, Bihar, India",Patna University,Not Working,5ft 3in,SMF1581506,Hindu
"I would like to become life partner of that person who loves me, understand me, accepted me with my all plus & minus points. I would like very caring, responsible & sensitive nature. My liking are reading books, see good pictures & plays, listening music, travel to natural places, forts. Myself nature is very caring & responsible. I would like a well educated, responsible,
understanding person as life partner. I also accept all his all plus & minus points with better understanding.",23,Mahar,"Pune, Maharashtra, India",,Others,5ft 2in,SMF1521747,Hindu
"I believe in being honest, understanding and positive towards life. Every day is a new day and have lot to give you. What I dislike most is to lie and giving excuses. I am a very simple gal with lots of dreams in my eyes for myself and my family.
",23,Brahmin,"Yamuna Nagar, Haryana, India",Punjab Technical University,Private Sector,5ft 8in,SMF1424630,Hindu
"I am jovial and fun loving person, love sports, listening to music , cooking, I am a very modest and sinsere person, i love to travel and meet people with various ideas and very social in nature. i looking for a handsome and well placed person",23,Vishwakarma,"Erode, Tamil Nadu, India",,Not Working,5ft 2in,SMF1580137,Hindu
"hi, harlin here, usually like to spend my time with my friends, engaged in social activities. I am some what reserved until and unless i don't like the person. always try to keep myself engaged in some work because i can't remain idle. I did my basic schooling from lady of fatima convent high school, patiala. high school from blossoms and graduation from RIMT and right now pursuing my PGDM from PCTE. ",23,Sikh - Khatri,"Patiala, Punjab, India",,Not Working,5ft 2in,SMF1448789,Sikh
I am god fearing person with lovable character. Looking for lovable person from a god fearing and well educated family. ,23,Sunni,"Malappuram, Kerala, India",Bangalore Medical College (BMC),Not Working,5ft 4in,SMF1420056,Muslim
"Am sweet, humorous, friendly and ambitious. Have completed my dental degree from Mumbai, and am on a track to pursue my Masters in Genetic coding from California, USA. ",23,Maratha,"Mumbai, Maharashtra, India",Other Medicine/ Dental Institute,Private Sector,5ft 3in,SMF1488860,Hindu
"i am honest, fun loving,polite,respect my elders and love kids. i love my family a lot n little bit sensitive too.i love to listen music,singing,dancing and love to study more and do job as well.i want my partner to be loyal, honest who loves my family too and do understand me as well.",23,Brahmin - Kulin,"Nawan Shehar, Punjab, India",Punjab Technical University,Not Working,5ft 5in,SMF1440882,Hindu
"My sister is a simple girl, loves to read and spend time with family. A well disciplined personality and of course a bright student at present in the last semester of her MCA from Khalikote college. 

",23,Brahmin - Danua,"Rayagada, Orissa, India","Berhampur University, Orissa",Not Working,5ft 6in,SMF1571642,Hindu
"engineering student. moderate small family. . religious upper middle class family.friends describe her very beautiful,very decent.wish complete education, then work where husband works.hobby singing.watching t.v.",23,Sunni,"Mangalore, Karnataka, India","Visveswaraiah Technological University, Karnataka",Not Working,5ft 5in,SMF1404482,Muslim
Obedience towards parents can be considered one of my virtue. Want a person from a family with good values. Doing my final year in B.Tech and would like to pursue higher studies. I am basically a calm and responsible person.,23,Sunni,"Thrissur, Kerala, India","Mahatma Gandhi University, Kerala",Not Working,5ft 2in,SMF1417180,Muslim
"I am nisha, doing MBA and fashion designing too. i have also done diploma in computer applications. ",23,Khatri,"Panipat, Haryana, India",Kurukshetra University,Not Working,5ft 2in,SMF1454320,Hindu
"Hi, looking for a groom for my sister, who is independent, confident, working, smart and a beautiful girl. She is presently working and pursuing MBA. She is a good cook and her hobbies include reading books and listening to music. ",23,Protestant,"Lonavala, Maharashtra, India",Other General University,Private Sector,5ft 3in,SMF1572595,Christian
We are looking for an alliance for our daughter who will graduate in May 2012 with a BS. She will be looking for a job and will work for a year or two before going for higher education. We are affluent Kerala Iyers and are looking for a boy with good values and similar culture.,23,Brahmin - Iyer,"Philadelphia, Pennsylvania",,Not Working,5ft 5in,penf729667,Hindu
I'm Kamya from Delhi and am living with my parents. Have 1 brother and elder sister and both are married. Am working with an MNC and have done my MBA from Gurgaon. My father is a retired pilot of Air India & mother is a house wife. ,23,Agarwal,"Delhi, Delhi, India",,MNC,5ft 5in,delf400092,Hindu
"She is well educated and well cultured. Having respect for all elders, very down to earth girl. Mixed of modernize and traditional. Myself (Bhuwan Budhani) father of bride working as a General Manager (commercial) with Belmaks Pvt Ltd, Mother is house wife, younger brother is pursuing B.Tech Mechanical 1st year in Reputed Engineering college of Faridabad.",23,Brahmin - Kumoani,"Faridabad, Haryana, India","Delhi College of Engineering, Delhi University",Private Sector,5ft 6in,SMF1556750,Hindu
"Impulsive and practical person who is dedicated towards family and work. Vibrant, loving, caring, sweet and innocent are the qualities that describes me.  ",23,Nai,"Nasik, Maharashtra, India","ILS, Pune",Private Sector,5ft 5in,SMF1566851,Hindu
"Am an independent, confident and a no-nonsense girl who is seeking a match from a professionally well qualified man who has a modern outlook towards life and believes in giving well-deserved respect to his life partner. ",23,Agarwal,"Pune, Maharashtra, India","ILS, Pune",Others,5ft 4in,SMF1533435,Hindu
"I am simple and adjustable girl, Straight forward person, working in college as a non-teaching staff, born and brought up in Bangalore. Mother is a house wife. 2 brother's and 2 sister's are there. 'he has to give respect to my parents'. ",23,OBC/Barber/Naayee,"Bangalore, Karnataka, India",Bangalore University,Others,5ft 5in,banf1103243,Hindu
"Am a Gursikh girl. I'm tall and well educated. I believe in guru granth sahib. Am well educated. My father and mother are Govt. teacher. I want a well educated person as my life partner. 

",23,Sikh - Gursikh,"Moga, Punjab, India",Punjab University,Not Working,5ft 6in,SMF1573947,Sikh
Simple with family values. Basically we belong from Mathura. Currently she is working as an asst. manager with ICICI bank. My father runs his own textile manufacturing business.,23,Rajput,"Delhi, Delhi, India",Manipal University,Private Sector,5ft 4in,SMF1576376,Hindu
"She is beautiful, down to earth, caring and soft spoken person. She is a blend of modern and traditional values. She is doing graduation from Daulat ram college of Delhi university and is a homely girl.",23,Saini,"Delhi, Delhi, India","Other College, Delhi University",Not Working,4ft 11in,SMF1572751,Hindu
"i am a cool guy with a charming nature 
i have very handsome & dashing personalty
 i cant hear wrong thing about me 
 my family is joint family
we all love each other very much
my house is very big
i am a self made man

  
                                                                                                                                                                                            ",23,Agarwal,"Delhi, Delhi, India",Indira Gandhi National Open University (IGNOU),Others,5ft 11in,SMF1576183,Hindu
"She is beautiful, cool, confident with cute smile. I am well qualified, talkative and very homely. Her smile is very cute,  aggressive, good good with good in behavior.",23,Rajput,"Delhi, Delhi, India",Aligarh Muslim University,MNC,5ft 2in,SMF1575593,Hindu
I'm a simple girl and living a simple lifestyle. From a 0middle class family. Believe in giving and taking respect and ready to obey my elders. I like cooking and my family is traditional.,23,Maurya,"Singrauli, Madhya Pradesh, India",,Not Working,5ft 2in,SMF1545878,Hindu
"This is roma, she comes across as a well cultured, homely, traditional yet modern girl, with strong family values and a positive outlook. Friendly and helpful. Gels well with people of all ages. Enjoys her work and respects time. 
",23,Kayastha,"Noida, Uttar Pradesh, India",Delhi University,Private Sector,5ft 3in,SMF1575189,Hindu
"I am a fun loving person, love music and reading novels, hobbies to dance, read, surf net and travel, have a very good communication skills, me fair, medium weight girl, love my family and my birth place, want to be independent in life. ",23,Catholic,"Vadodara, Gujarat, India",Others,,5ft 3in,SMF1509785,Christian
"Hello, I am Aparna Khade. I have done post graduate diploma in management in HR stream. I am currently working as a Sr. Admin Executive in Lloyd Impex Pvt. Ltd. My hobbies are Reading, Surfing, drawing and traveling. My friends describe me as witty and confident. In my future partner, i value intelligence, loyalty, sincerity. My family is pretty orthodox. ",23,Bhandari,"Mumbai, Maharashtra, India","Symbiosis Institute of Business Management (SIBM), Pune",Private Sector,5ft 3in,mumf566950,Hindu
"My daughter has done MA and listening to Music. She is a pretty girl and was working briefly. She is widely traveled and knows cooking, embroidery and other arts. We are looking for an accomplished boy either in the public or the private sector.",23,Brahmin,"Delhi, Delhi, India",,Not Working,5ft 6in,SMF1574280,Hindu
"A simple and fun loving girl who is lively and very honest. I like singing, dancing and making others happy, i overcome with worst situations very soon. Looking forward for a loyal and friendly guy who respects elders.",23,Kayastha,"Lucknow, Uttar Pradesh, India",Lucknow University,MNC,5ft 4in,SMF1498899,Hindu
"I am simple, loving, optimistic girl. I always like to be with people and love to sing and travel. For me the most important thing in life is my family and i can do whatever it takes to maintain a relationship. ",23,,"Bangalore, Karnataka, India",,MNC,5ft 4in,SMF1573320,Hindu
,23,Bengali,"Krishnanagar, West Bengal, India",,Not Working,5ft 4in,bahf1085685,Hindu
"Listening music, dancing, cooking, playing football are some of hobbies; Currently preparing for civil service examination. I want someone in my life who will be there for me and with me. Is loving, caring in nature.",23,Jat,"Delhi, Delhi, India",Punjab Technical University,Not Working,5ft 4in,SMF1487589,Hindu
"I'm decent, smart, beautiful girl, I like veg and non-veg both, I dislike showoff person and and those specially who drink and smoke. I'm looking that kind of person who are true smart and professional.",23,Rajput,"Delhi, Delhi, India",Manipal University,Private Sector,5ft 4in,SMF1539344,Hindu
"i am tall ,pursuing my masters in human development, i need a gursikh match
",23,Sikh - Khatri,"Jammu, Jammu and Kashmir, India",,Not Working,5ft 8in,SMF1524864,Sikh
"Hello, I m a very simple cultured girl who believes in respecting elders and Indian traditional values. For me understanding and honesty is most important than anything else in a relationship and more importantly in a marriage.",23,Kshatriya,,,Not Working,5ft 4in,SMF1508621,Hindu
"I am MBA, LLB, working as GM HRD, premature retire from Army (Corps of signal) own house in Gurgaon, native place vill Chogawna (indri) Disstt Karnal) wife -house wife.Son doing B.Tech Amity Nodia. We are jat sikh Sandhu family, fully faith in GURUGRANTH Sahib. family Values have utmost Value.  ",23,Sikh - Jat,"Gurgaon, Haryana, India",Other Business Institute,Not Working,5ft 4in,SMF1453129,Sikh
"She is youngest in family. Date of Birth: 28 June 1990, Birth Time: 13:11 in Delhi. Personality: Very fair & Good Looking
Qualifications: CA qualified in May 2011 in first attempt, remained throughout topper in her academic life. Occupation: working in a US Based MNC , got recruited through campus placement. Father: Businessman, deals in petro products. Mother: Homemaker. Brothers: 2 elder, Ca Vinay Garg, working as AM (finance) in Power finance Corp, Delhi & CA Vivek Garg working in a reputed CA firm, Delhi. We are looking for a CA and CS in Delhi. ",23,Agarwal,"Delhi, Delhi, India",,MNC,5ft 1in,delf1302491,Hindu
"my daughter is a very simple, fun loving girl..want to achieve great success in her life and want to serve her country and looking for her partner who is in defence.my daughter loves travelling, shopping, cooking and catching up with her friends.",23,Khandayat,"Delhi, Delhi, India",Others,Not Working,5ft 2in,SMF1463792,Hindu
"Fun loving, adaptable, caring and sensitive, determined, hardworking, outgoing. 

",23,Tanti,,Other General University,Not Working,5ft 2in,SMF1475752,Hindu
"I AM SIMPLE ,EDUCTAED GIRL  BELIVE IN TRUST ,HARDWORK ALWAYS ,AND ACHEIVE THE ALL TARGET,LIFE IS SO DIFFICULT BUT WE HAVE TO FACE ALL PROBLEMS IN ANY SITUATION ,,,,,,,,THIS IS CALLED A LIFE ",23,Punjabi,"Delhi, Delhi, India",,MNC,5ft 5in,delf1360160,Hindu
"She is a very sweet girl. She was born and brought up in middle class family. She likes to travel, arts and crafts. She believes in go with the flow type of girl. She did her interior decorate from Pune.  ",23,Maheshwari,"Pune, Maharashtra, India",,Not Working,5ft 3in,SMF1570745,Hindu
"Fun loving person, Loves Art, Books, Painting, Writing etc. Loves to interact with people. Loves Animals. Nature lover, Likes to talk, Can cook a bit of non-veg (though cant eat it ). ",23,Ezhava,,,Not Working,4ft 11in,SMF1549129,Hindu
I am cool and simple. ,23,Naidu,"Guntur, Andhra Pradesh, India",,Private Sector,5ft 3in,gunf1093635,Hindu
I have completed Msc in nutritional sciences and qualify NET EXAM in Dec. ,23,Rajput,"Delhi, Delhi, India",Allahabad University,Others,5ft 5in,SMF1525447,Hindu
"Hi, I am 22 years old and belong to a Christian family. I am searching for a partner who would rather be more of a friend throughout. He should be understanding, loving, well off and supportive to me in all circumstances.",23,Protestant,"Delhi, Delhi, India",Other General University,Central Government,5ft 4in,SMF1509931,Christian
"I am a simple girl, with a lot of hopes and aspirations. Hail from a conservative family where education/mannerism are valued more than financial status. In search of such decent partner who is non smoker/drinker.",23,Brahmin,"Bhubaneshwar, Orissa, India",,Private Sector,5ft 6in,SMF1570252,Hindu
"She is a simple girl, respects family values and relationships. We live in a joint family. She is down to earth girl.
Loves to spend time with friends and family. She is self employed, loving, caring and affectionate by nature.",23,Agarwal,"Vadodara, Gujarat, India",Institute of Chartered Accountants of India (ICAI),Others,5ft 1in,SMF1570525,Hindu
she is good looking and down to earth girl. ,23,Sikh - Arora,"Sirsa, Haryana, India",Other Diploma Institute,Private Sector,5ft 3in,SMF1407872,Sikh
I m having a polite nature. I am down to earth with full of positive energy. I am very soft spoken girl & also know the family values. I m having good moral values & respect for others. I just believe in simple living and high thinking.,23,Jatav,"Aligarh, Uttar Pradesh, India",Other General University,Not Working,5ft 4in,alif1346361,Hindu
