aboutText,age,caste,city,college,employedIn,height,profileID,religion
"She is an attractive woman who likes to likes to live life as it comes. A science graduate, she has done her MBA from Narsee Monjee and is currently working with a leading consumer goods company as a Brand Manager.
Independent yet very warm, open minded yet with very strong moral code, she is intelligent, fun and creative. Moreover, she is a very caring, loving person who would shower utmost attention on her loved ones.
We are a family of four, where she is the elder one.
Family
Father was a government servant and he retired a few months ago. Mother is a housewife. I(sister) am working in a software firm. We are a simple, middle class family with strong value system.
Education
MBA - Narsee Monjee, Mumbai
Graduation - Delhi University
Occupation
Working as a Manager with a leading consumer goods company in Mumbai.
",35,Agarwal,"Mumbai, Maharashtra, India",,MNC,5ft 4in,mumf1303176,Hindu
"Hi!!

first and foremost i would require u to go through my profile completely my father is a bengali and mother is sindhi
so please go through the profile and then only approach. i belong to a cosmo background. 
I would describe myself as a funloving person.... and
like to make friends but I am choosy. I am Mumbai based
i am in the process of changing my career profile I have cosmo background. 
my father is a bengali and mother is sindhi
I have one elder sister who is already married
We are a broadminded family. So my partner preference
would be of one who has a broad outlook, caring, understanding
decent and reasonably goodlooking. 
and ofcourse qualified and from a respectable family. 
(Preference would be given to Mumbai/ Pune based proposals)",35,Brahmin - Bengali,"Mumbai, Maharashtra, India",,,5ft 3in,tmc2c8101,Hindu
"A tall,fair girl with pleasing personality.I have done MA in History of arts from MS University ,Baroda.
I am a creative person and am a freelance art consultant,Iam also editing an art Magazine.I am quite friendly in nature I like reading and Music. I have a younger sister who is a computer enthuisiast. My dad is retired very senior Defence officer and my mom is a damn good homemaker and I am proud of my Family. I like good things in life and would like my life partner to be supportive of my creative nature and should be my friend, guide and philospher. he should have sense of humour and positive attitude in life.",35,Khatri,"Delhi, Delhi, India",,,5ft 6in,bhvz_15,Hindu
"I'm very simple broad mined. I would describe myself as a ambition, believe in simplicity, honest, friendly, down to earth, hard working, broad mined, responsible, loving, caring, likes to enjoy life to fullest. Loves travelling, reading, music, I believe in family values and respect elders. In my family, my father is expired. My three elder brother and my mother, 1st elder brother married, working in sugar mill in gonda. And my second elder brother also married, teaching in management institute in Lucknow, & my younger brother doing business, & my mother is housewife & very simple. M.A. in Hindi From Bahraich, Computer Diploma. I'm teaching in computer institute in Bahraich.",35,Vishwakarma,"Bahraich, Uttar Pradesh, India",,Private Sector,5ft 4in,bahf1334195,Hindu
"I'm hearing impaired person & can hear using hearing aid but can speak normally. I'm god fearing, honest, open minded, fun loving, broad minded, caring, respect others. I like travelling & to help poor. ",35,Others,"Kochi, Kerala, India",,Not Working,5ft 2in,SMF1390063,Muslim
She is down to earth homely  working girl.Fun loving honest n family oriented girl.,35,Rajput,"Chandigarh, Chandigarh, India","ICFAI, Hyderabad",Private Sector,5ft 2in,SMF1390092,Hindu
"we are residing in pune and my daughter is very beautiful , she has completed her bcom and her mdba from symbi, also done diplomas in fashios designing and in computers from niit...  we would like a well settled boy for her from mumbai, uk, dubai or austrailia... she is very socialising... fun loving... mixes with any age group.. the guy should be with strong family values yet modern and balanced in life ",35,,"Pune, Maharashtra, India",,,5ft 4in,vivaahh,Jain
"I am living with my parents in our own house. I am a Civil Engineer, working as Design engineer in a multinational company in Kolkata. I am fair and good looking. I am simple , kindhearted and happy-go-lucky. I like to spend my leisure time by reading books and listening songs. I like to travel also. ",35,Mahisya,"Kolkata, West Bengal, India",,,5ft,kolf1371540,Hindu
"i m family oriented,a blend of tradition and modernity,generous by nature,love music and reading.
searching for a guy who is loving,caring,respects women and believes in family values.",35,,,,State Government,5ft 4in,ritu_in_a,Hindu
"I am currently pursuing a PhD in Biochemistry. Quiet and sensitive by nature, I am very much a family person. At the same time, it is important for me to pursue my field of work. My hobbies include painting, reading and listening to music. I would like to spend my life with a companion who is confident and understanding and who like me, puts family above all else. I am manglik and my family believes in horoscope matching.",35,Shewetamber,"Jaipur, Rajasthan, India",,Others,5ft 1in,AVSV,Jain
"Looking for a loving n caring partner ..... well settled well qualified...... am a very easy going lady ..... take my life as it comes ..... love to be myself .......

looking for a partner preferably from Bangalore .......",35,Brahmin,"Bangalore, Karnataka, India",,,5ft 3in,banf1339798,Hindu
"I am simple, modest person,with effervescence in life and hoping for best in life.Like nature and like to travel around the world.",35,Yadav,"Bangalore, Karnataka, India",,Private Sector,5ft 1in,SMF1388621,Hindu
"I am extrovert yet simple, Bubbly yet responsible, care for small  things in life. I love to experiment with spices- so can say a good cook,enjoys music of all types.I am staying in delhi with my parents and a sweet little angel of 3 yrs. She is my heart........We are two ( me and baby) looking for some one who likes to complete my small family.",35,Khatri,"Delhi, Delhi, India",,,5ft 1in,delf1358495,Hindu
"my self a convent educated, MBA graduate working as teacher, who belives in deep family bonding, I have face pigmentation occured recently due to sun stroke which is 75 cured else fair complexion.",35,Kayastha,"Delhi, Delhi, India",,Private Sector,5ft 4in,delf1351728,Hindu
"I am currently working in Delhi as a manager with a MNC. I am a girl who has grown up in a middle class down to earth family. We believe more in treasuring our customs and traditions yet we are paced up with the current society and not forgetting our moral values. I love to read, write, travel and cook. ",35,Khatri,"Delhi, Delhi, India",Other Fashion/ Accessory Design Institute,Private Sector,5ft 3in,lucf753896,Hindu
"Rajashree Basu is a first class Masters in Computer Application (MCA) degree holder. 

She is slim, fair, good natured, very beautiful and a talented artist. 

Her zodiac sign is Gemini / Debgon.

Rajashree teaches computer sciences in an CBSE board school, and lives with her parents and brother in their own flat in Kolkata.

Her family seeks a handsome, well educated and well established groom between 33 and 38 years of age.

About her family: 
Rajashree comes from a cultured, West Bengal Kayastha Basu family. 

Her father is a retired Deputy Secretary in the Finance Department of the Government of West Bengal, and all her paternal and maternal uncles are established professionals. She is the youngest of 3 siblings, and has an older sister (who is married) and brother (who isn't).

About her education:
Rajashree completed her Masters in Computer Applications (MCA) degree with a first class.

About her work: 
She teaches Computer Science in a CBSE board school",35,Kayastha,"Kolkata, West Bengal, India",,,5ft 5in,kolf1330028,Hindu
"My daughter is soft spoken,adjustable type,helping nature,like to be a house wife.good hearted,adjustable to all environment.jovel and friendly.thanks ",35,Balija,"Bangalore, Karnataka, India",,Not Working,5ft 2in,banf1361754,Hindu
"Simplicity is something that is very important for a person. However, being simple requires a lot of time. This is something true and I believe that inculcating this habit in oneself is very difficult. I feel very proud to say that I am very simple as a person. 
I have been the same since childhood. People like this in me and appreciate this quality of mine. I never feel proud of the fact that people appreciate me. I take their admiration in a very modest manner. This is the best quality in me, according to me. 
I am a Senior Consultant and I like my work. I wish to excel in the same field in future. Before that, I did graduation in BE (CS/IT) from New Bombay. After that, I started working. 
My mother is a homemaker and my sister is married. I have two brothers and both of them are well flourished business men. My father expired and left us alone in this world. Me and my whole family miss him a lot. Apart from that, I love all my family members and I am proud to have them as the closest people in my life. 
I dont have many friends but the few of them that I have are very close to me. 
I like to sing and dance, like any other girl. I enjoy it and this refreshes my mind. I also like to watch movies and listen to music. This soothes my mind the most.
",35,Agarwal,"Mumbai, Maharashtra, India",,,5ft,mumf1314031,Hindu
I belong to an upper-middle class educated nuclear family working with a Financial Services organisation and am looking for someone who comes from similar salaried class back ground. I love to learn new things in life. People say I am a sunshine personality. I love to hit the dance floor sometimes and equally comfortable at work place and at home doing simple chores and tastefully managing my heaven.,35,Sikh - Khatri,"Delhi, Delhi, India",,MNC,5ft 5in,delf1238182,Sikh
"She is a very friendly and enthusiastic girl. She has various interests like cooking, traveling and sports. Apart from great educational background, She looks for a person who can appreciate eastern values with modern approach. She looks for an educated and good-natured person to be her groom. Family and education are very important to her.",35,Vankar,Others,,Private Sector,5ft 3in,othf1383572,Hindu
i m simple girl.my hobbies cooking and listen music.i m interested singing.my family is simple and well educated.my mother is house wife. my father is retired insistent tregeri officer in mathura. ,35,Kayastha,"Mathura, Uttar Pradesh, India",,,5ft 1in,matf1382755,Hindu
"good Character,spiritual mind, beautiful look ,medium educational qualification,disciplined,charming, nice-family background ,  not any other demands.  ",35,Orthodox,"Kalpetta/Wayanad, Kerala, India",,,5ft 6in,kalf1381105,Christian
"My sister is beautiful, religious and homely in nature. Regular at Salah, zikr and fasting, observes hijab. We belong to a Sunni, Sheikh, middle class family of Western U.P.",35,Others,"Moradabad, Uttar Pradesh, India",,,5ft 2in,morf1350506,Muslim
"Born-again, spirit-filled person who will be able to accept without jewels and have a zeal for God's ministry and christ-centered life, yearning to fulfill the will of God in all walks of life.",35,Others,"Coimbatore, Tamil Nadu, India",,Others,5ft 2in,coif1315750,Christian
"i believe god very much. m very understanding, loving and caring person. also very adjustable person. i love my family a lot. i like to be a house wife.",35,Vishwakarma,"Bangalore, Karnataka, India",,,5ft 2in,banf1269240,Hindu
"Hi, myself an assamese brahmin girl, born and brought up outside asssam. Presently residing with my family in guwahati. I have done my Msc and currently working in govt. research poject as research associate. In short I can describe myself as a confident modern girl with values. I love travelling, poetry and music. I am looking for a life partner who has a very good personality. He should be well qualified(BE/Btech, MBA, CA, MBBS etc. ), honest, handsome loving, caring and understanding",35,Brahmin,"Guwahati, Assam, India",,,5ft 3in,guwf1368137,Hindu
"Assalaamualaikum My Sister is sensible, loving and caring with regards to her family. She is a moderate cook.She wears a Hijab.She has a balanced knowledge of Deen & Duniya...


We donot belive in grave worship n giving fathiha.

Our Family is religious and tries to follow Islam through Quran and Sahi hadith.We r influenced very much by world renowned Islamic scholars / dayees like Dr. Zakir Naik, Dr. Israr Ahmed etc. for lectures, discussions, symposia, debates and by their logical and scientific approach towards Islam.

Contact us if u r interested in marriage.Paid member at Jeevansathi: Profile : nah

May Allah swt help u all out there to meet ur soulmate Insh'Allah. 

",35,Others,"Mumbai, Maharashtra, India","Other College, Mumbai University",Others,5ft 2in,mumf309753,Muslim
"This profile is for my daughter. She has completed MS in Computer Science and works in software field. We are basically from Hyderabad. We parents live in Hyderabad and are currently visiting U.S.
Please contact for more details. ",35,Sunni,New Jersey,,Private Sector,5ft 2in,newf1364395,Muslim
"Namastey! I am a simple creative girl with spiritual bent of mind.
I'm a go getter and sky is the limit for me when it comes to my loved ones.
Being an outright and honest person,I expect the same from my life partner so that we share our lives with each other soulfully.

For me family bonding and mutual understanding is of utmost importance. Respect all and accept all is my lifetime attitude. To spread smile and radiance is what i believe in for there are enough tears to make anyone soggy anyway.

I love to sing,meditate, write realistic and spiritual stuff, compose poetry, paint,sketch, read philosophy and dance . I am a strict vegetarian and nature lover. I love to travel and write about my travel experiences.I love to listen to all kinds of music depending on my mood. I also like watching sensible, realistic, fiction and romantic movies, in short anything that touches my wit and sensibility as per the spur of the mood that moment.

My husband would definitely take home a daughter-in-love for his parents (not daughter-in-law) and I too wish to get home a son-in-love for my parents(not son-in-law) because where love prevails, laws need not be formed for order.... Love is the only connect whatsoever.

 All the best for finding your soul mate of life times

My husband would definitely take home a daughter-in-love for his parents (not daughter-in-law) and I too wish to get home a son-in-love for my parents(not son-in-law) because where love prevails, laws need not ",35,Dhoba,"Delhi, Delhi, India",,,5ft 1in,delf1362089,Hindu
"good looking, fair, religious, god fearing, conservative family type, homely girl, traditional and culture family background, belong to well known doctor's family in our home town, found of music, reading, love to visit holy places, hill station's, treveling, cooking, love pet's, cleanliness, clean habit's , personal and family hyginie, neuclear family, ancestral origin is from, w.b, 24,paraganas, modhom gram, four father's from jamindar's family, father retired textile engi, mother home maker, big brother is a b.com graduate, and done hotel mngmnt, in business and settled in abroad, my daughter is a pet's lover much more detail's we meet through conversation and we meet. thank'u. from, ashish dr.j. kr mukherjee.",35,Brahmin - Kulin,,,,5ft 2in,surf1282244,Hindu
I am simple n sober girl from an educated family. my strong beleif is that hard work always pays. i have an average built and 5feet 4 inches in height. my strenghts are my vivacious nad helpful nature.,35,OBC/Barber/Naayee,"Delhi, Delhi, India",,Private Sector,5ft 4in,delf1299717,Hindu
"Hi,I am looking for someone who would be great companion througout 
my life,and he is loving.mature,and
strong human values,belive in god.
my father is business man and my mother is house wife,I have two 
brothers hi got married.",35,Lohana,"Rajkot, Gujarat, India",,,5ft 6in,almf1367293,Hindu
she is my neice a young widow with a 6 yrs old son and she wants a partner who will accept her son along with her. She is loyal and family oriented. Believes in honesty and is willing to accommadate anything,35,Brahmin - Vaidiki,"Secunderabad, Andhra Pradesh, India",,,5ft 3in,hydf1250881,Hindu
"she is intelligent,goodlooking,well educated,relegious with high family value.she belongs to  educated,respected n status buisness family.our maternal n paternal family is well setteled in delhi n ggn.",35,Arora,"Bhiwani, Haryana, India",,,5ft 4in,bhif1342265,Hindu
"Belief in God,not ritualistic but spiritual in heart.One who has set priciples for his own apart from religios diktat and follow those principles honestly.",35,Others,"Kolkata, West Bengal, India",,,5ft 1in,kolf1329906,Muslim
"About me

I would describe myself as an honest and a genuine person. Someone who prefesr transperancy in every aspect of life. A simple easy going individual who is cheerful and a thoughful individual. Someone who is passionate about minutest of things in life. A free soul who loves travelling, reading and exploring new ideas and thoughts..... 
Lets get in touch if you would like to know me more:)

Proffesionally, I am an IT consultant, currently working with an i-bank. 

My soulmate search is on... 
I would love to meet a mature and a sensible individual.... who is simple and easy to get along with. He should be genuinely interested in sharing life together. Someone who can be a companion across all walks of life. 
If you are a cool headed person and enjoy good conversations, i would love to know you more. 

Hopefully this site helps us connect and we can know more about each other, Rest is destiny:)

Thanks for stopping by.",35,Arora,"Bangalore, Karnataka, India",,,5ft 5in,banf1364130,Hindu
I AM SIMPLE BUT SHORT TEMPERED. INTERESTED IN COOKING. NOT INTERESTED IN WORKING AFTER MARRIAGE.,35,Sia,"Mumbai, Maharashtra, India",,Others,5ft 8in,mumf1266178,Muslim
We are looking suitable partner for our daughter. She is a homeopathic doctor and has done higher studies in UK. She stayed in UK for 5 yrs and is now in India.,35,Sikh - Khatri,"Karnal, Haryana, India",,,5ft 3in,krnf1208127,Sikh
"I would like my future partner to be well educated, easygoing, smart, humorous, faithful and more like a friend.
I believe that any relationship should help you grow as a person and should not restrict yourself from being the way you are.",35,Brahmin - Kokanastha,"Mumbai, Maharashtra, India",,,5ft,mumf1364276,Hindu
"Neetu is very sensitive, extremly caring & dedicated to a cause. She loves teaching & make difference in the lives of those who she is able to touch to. She is very honest & carries very high moral & ethical charatecter. She is perfect blend of Indian values & modernity.",35,,,,Private Sector,5ft,neetuavasthi,Hindu
"I think that it is the most difficult task to describe someone in words.
Well about my daughter, everyone would describe her as a simple, soft spoken, down to earth, elegant with charming personality. As far as her qualification is concerned, she has done B. E Computers, working in an MNC. She is well educated and balanced person imbibed with
high moral values. She has traditional values with modern outlook. She can win anybody heart with her simplicity and friendliness. 

Parents are technically qualified post graduates. Ours is a respectable Hindu family settled in Delhi for last 60 years. ",35,Gupta,"Delhi, Delhi, India",,,5ft 6in,delf1247095,Hindu
"I am polite, courteous & vegetarian, I have done my graduation from Jesus & Marry college New Delhi. I completed my MA (Pol. Science)and   M.Phil from Barkatullah university, Bhopal & Vikram University respectively. At present i am working as visiting faculty in a Management Institute teaching Pol. Science to BA LLB students in Delhi. In my family i have 2 brothers, one is working in NCDC, Delhi as Technical Assistant and another one is doing Phd. My elder sister is PCS officer & married. My father is retired Senior Officer of Govt. of India and my mother is house wife",35,Jatav,"Delhi, Delhi, India",,,5ft 3in,delm1354969,Hindu
"I would like to have a life partner who have all the qualities of a good human being, GOD loving, True at heart and understanding.Must believe in one wife only and have no girl friends",35,Brahmin - Gaur,"Delhi, Delhi, India",,,5ft 2in,delf1322406,Hindu
"well; not that it is very easy to write about oneself but lets give it the best shot (let me know if i get the Bookers prize for writing well). Jokes apart but here it goes.... 
My mom tells me i have chakras on the soles of my feet (meaning that people with chakras travel a lot). I was born in Visakhapatnam and was brought up in Jamshedpur (You are right.. the steel city). After completing my schooling i studied my graduation in Agra and Post graduation happened in Gangtok (Sikkim). My first job took me to Hyderabad. I moved on from hyderabad to Gurgaon for my second job and then to Mumbai and back again to Gurgaon. And thanks to my job profile i have to be frequently travelling (an average of 10-12 days a month)
i am a strong believer in GOD (though not orthodoxly religious), confident, willing to take on challenges in life (at both the personal and professional front). As much as i am career oriented i am a firm believer that the women is the 'home maker' and family always comes first for me. 
i love to listen to good music (actually i am a versatile listener and can appreciate everything from M S Subbalakshmi to Pearl Jam... and that also without linguistic barriers)
i love photography (somewhat passionately), cooking (reasonably well, my frinds have survived my culinary experimentation :-)) and driving (currently enjoying my Maruti Zen)

My family is also a third generation Dayalbagh Satsangi- you may have to get in touch with me or my parents to understand this because not much can be written about this in this column. 
",35,Brahmin,"Gurgaon, Haryana, India",,Private Sector,5ft 4in,gurf1041892,Hindu
"Hi, I am simple, humorous, straight forward, and adventurous. I like watching movies, listening to music, painting and reading though do not get much time to paint and read due to work.  I do love dancing and watch most of the dance shows on TV. I like to cook but do so generally of weekends.Looking for a person who I can gel with and would make me comfortable to spend the rest of my life with.",35,Others,"Mumbai, Maharashtra, India",Institute of Chartered Accountants of India (ICAI),MNC,5ft 4in,mumf1042923,Christian
At the age of only six months I was attacked by Polio.Even after regular treatment my left leg remained weak.I have to wear callipers and hold stick during walking. My left lung was also affected partially. But I can move everywhere with confidence.I manage all works at home also normally and without difficulty.,35,Kayastha,"Noida, Uttar Pradesh, India",,Private Sector,5ft,x1387586,Hindu
"hii...i'm just a simple, slim n pretty girl...lookin for a smart guy wit a nice personality...wit no pride...wit whom i can hold hands n walk for the rest of my life in dis beautiful journey called life...",35,Others,"Mumbai, Maharashtra, India",,,5ft 3in,mumf1350466,Christian
"Hi, I am simple Girl with modern outlook. Believe to be balance in personal & professional life. Have respect for elders. God believer. Spk Hindi,English,Bengali & Assameese.",35,Kayastha,"Delhi, Delhi, India",,,5ft 3in,delf1320689,Hindu
"I am a simple female who believes in having fun all around. I live life at the fullest without much complaining about life. My nature is that of a very friendly person who mingles with people easily. Further, I give utmost preference to our traditional values and completely respect them. On the contrary I am modern as well. 
Currently I am working as a Marketing head in an MNC. I am happy and satisfied with my professional life and in future I would like to be in the same field. 
My major weakness is that I am straight forward and prefer to speak in front of the person rather than speaking behind their back. 
I have a loving family and I respect them a lot. My parents are engrossed in business and I have a sweet sister who is pursuing her MBA from abroad. 
In my higher education sector I have completed B com from Sri Ram College Of Commerce and MBA from Times School of Management. 
I have very few friends in my life and I generally spend my time with them. We go out for movies and also travel to new places. Further, I like to cook, dance, swim and listen to music of my choice. 
",35,Brahmin,"Delhi, Delhi, India",,,5ft 5in,delf1332590,Hindu
"My sister s very moral, god fearing and intelligent girl.

Now she s working as Judicial Officer (JUDGE) at Malur ( kolar dist)

our home town is Arsikere (hassan dist)",35,Others,,,State Government,5ft 3in,banf1022397,Muslim
"Educated, Understanding, Intelligent, Very nice, very cooperative, Understand the values, Very careing. Wants an Open atmosphere, Educated, Broadthinking, Intelligent people",35,Brahmin - Goswami/Gosavi,"Bareilly, Uttar Pradesh, India",,,5ft,barf1294668,Hindu
"very simple,sober yet smart career oriented but not at the cost of family, looking for mature simple sober and well qualified person.
to me marriage is a pious relationship that survives on mutual trust and respect",35,Arora,,,,5ft,hisf1215786,Hindu
"I am a simple person with positive outlook towards life ,working in a reputed IT company as senior software engineer in pune .
Love to live life every minutes..
",35,Kayastha,"Bangalore, Karnataka, India",,,5ft 1in,banf1074642,Hindu
