aboutText,age,caste,city,college,employedIn,height,profileID,religion
"I trust in God and believe in me.I respect my parents and have special regard for my brothers.I believe in Simple living and high morals. Working as Senior Manager in a Reputed Bank. Fond of music, reading classic books and playing badminton.",35,Sikh - Jat,"Mumbai, Maharashtra, India","Other College, Mumbai University",MNC,5ft 3in,mumf1285090,Sikh
"I am a God fearing, caring and loving person. I have 2 children, living with me, both are sons, of which one is of 10 years and the other of 6 years and am working in a private sector. And am living with my parents.",35,Others,"Puducherry, Pondicherry, India","Bharathidasan University, Tamil Nadu",Private Sector,5ft 3in,ponf248689,Christian
"working in a private hospital as Junior Doctor.
completed USMLE Step1 with 90%.
Looking for only doctor or PhD boy either in India or USA. Others please excuse.
Boy (doctors) should be either doing residency in USA or in the process of going to US.
For PhD they should be well settled in US.
Boy should be affluent, teetotaller and vegetarian",35,,,,,,drsha,Hindu
" I am a very simple person wishing to have a simple life. I value traditions and culture. I recite suprabhahtam often while I enjoy reading Ayn Rand and Paulo Coelho. I am a strong believer in God. I am the only daughter to my mother who is dependent on me. Hence, I have to take care of my mother for foreseeable future. My father does not live with us. He stays with his first wife and family. He does visit us often. I like my parents a lot. I was married in 2002, got separated in 2005 and currenty awaiting divorce. Just a note about me as a clarification. Though I am a simple woman with life's simple desires, people often mistake me for not as sophisticated. However, I have a fairly high sophisticated values and expectations about life and my future partner. I consider myself a liberated professional Indian women with extensive Western cultural exposure due to my upbringing. I am looking for someone who is responsible and caring. Who loves to be with the family. He must understand the need to support my mother even after our marriage. She is all alone and has no one except me. Therefore, I am looking for someone who can understand this and would allow me to do so. I prefer a well educated person even if he is financially not doing well at this time. Must be bias-free and be able to see the world with an open heart and mind. Since I prefer a simple life, I am always content with what I have been blessed with. If interested, please contact me. Since, I cannot afford a paid membership, I will not be able to view your contact information. There is so much to say about oneself but, too difficult to say. Finally, I am here to be everything for that one person throughout my life.",35,Gavara,"Vishakhapatnam, Andhra Pradesh, India",,,5ft 3in,visf1363926,Hindu
"I was born in Chennai, but have been brought up and educated in AP. I have done my school education under ICSE stream from a reputed convent school. My father is a retired executive of ITC ltd. And my mother is a housewife. My father was educated and brought up in Chennai and my mother in Bombay and Delhi. I'm an only child. I know English, Hindi, Malayalam and Telugu. I am a qualified chartered accountant.",35,Nair,"Guntur, Andhra Pradesh, India",,Not Working,5ft 6in,gunf731988,Hindu
"We are seeking a suitable alliance for our daughter. We are looking for a suitable groom who respects elders, down to earth and fun loving. Our family is settled in mumbai. father retired was wrkg with pharma co. in mumbai, mother housewife. We have 3 daughters. Our 2 daughters are married and settled in mumbai and Australia. we looking a suitable match for our younger daughter she is a commerce graduate from mumbai university and wrkg. She's smart, intelligent, outspoken, caring, beautiful and love pets.",35,Ezhava,"Mumbai, Maharashtra, India",,,5ft 4in,othf970569,Hindu
"Hi,my name is Yafa Korlekar from Mumbai.working for Elal.I am looking for a suitable Jewish boy who values life,family,religion as his utmost priorites.i would love to build a strong long lasting relationship based on love ,respect and trust.",35,,"Mumbai, Maharashtra, India",,,5ft 2in,mumf1087134,Jewish
"I am a simple funlovingl, I take life as it comes and live its fullest. I like travelling, cooking, listning to music & waching movies. l am currently woking with an insurance company as insurance executive. looking for a understanding, caring partner.",35,Kayastha,"Mumbai, Maharashtra, India",,Others,5ft 8in,mumf975506,Hindu
I am a simple middle class girl. I wish to have a secured & happy family life. I have 2 sisters who are married & I live with my mother. I like to hang out with friends sometime & have good time. I try a lot of experiments when it comes to cooking. I like to do meditation & sometimes like to spend time with myself. I love peaceful music which refreshes my mood. ,35,Dhangar,"Pune, Maharashtra, India",,Private Sector,5ft 5in,SMF1539102,Hindu
"I am a hard working and dedicated person and a fun loving girl, family values matter a lot to me and my friends describes me as a conservatively modern human. I prefer to work after marriage also. ",35,Agarwal,"Delhi, Delhi, India",Pune University,Private Sector,5ft 5in,morf1003331,Hindu
"Ours is a highly educated ,Gaur Brahmin family from western U.P settled in Noida.Brother B.Tech ,M.B.A wrking in reputed M.N.C,sister in law M.B.A wrking in M.N.C father highly placed Cent.Govt officer in delhi Mother P.G.I am M.B.B.S,P.G Dip (Opthal)currently persuing DNB(Opthal)from Arvind Eye hosp. Madurai(T.N) one of the most prestigious eye institute.Marriage with NRI lasted few days and divorced with mutual consent.My hobbies include reading net surfing,listening to music.
",35,Brahmin,,,Private Sector,5ft 3in,noif428252,Hindu
"I AM A FRIENDLY PERSON HAVING RESPECT FOR PEOPLE AND LOVE TO BE PROFESSIONAL. AM PURSUING CA AND CS FINAL. AM M.COM QUALIFIED. LIKE TRAVELING TO NEW PLACES, KNOWING PEOPLE AROUND AND DOING PHOTOGRAPHY. ",35,Scheduled Caste,"Mumbai, Maharashtra, India",Institute of Chartered Accountants of India (ICAI),Others,5ft 4in,mumf219821,Hindu
"i want someone who can love me, pamper me tons and give me the required necessary luxuries of life...i like shopping, travelling and promise to be the best wife ",35,Vaishnav,"Mumbai, Maharashtra, India",,,5ft 5in,mumf1373177,Hindu
"This is my friend's profile. I am simple, loving, caring, decent, cool & calm by nature, straight forward & honest also. I am a good singer. I am attached with an Interior designers & design Consultant Company as a Computer operator & office administrator after i lost my husband. I am very homely. I give due importance to my parent's decisions. I have a little daughter of 6 years old. I live with my mother in law in law's house.  ",35,Brahmin,"Kolkata, West Bengal, India",,,5ft 2in,kolf622790,Hindu
"I am an outgoing person with very strong family values. i have studied and lived in australia for 20 years. i am currently working in Bangalore as a director, sales and marketing. i have one younger brother who lives in London. my parents live in australia. we are from Delhi and my extended family still lives in Delhi.",35,Khatri,"Bangalore, Karnataka, India",,MNC,5ft 1in,SMF1474229,Hindu
"I am outgoing and look forward to new experiences to enrich my ability to better understand people from all walks of life. I get along mostly with people who are down to earth and have a zeal for life. I love to laugh and believe that humor in life is very important. Life is too short, so I believe in making the most of every single day by doing good deeds and keeping the people we love and care for happy.

I came to the United States 8 years ago to pursue higher education, have received a B. S and M. S in Computer Science. Besides studies, throughtout my time here I have constantly tried to gain from my social interactions. I believe am a good blend of the goodness I came with and the exposure that I am currently getting. I believe in being open-minded, making the most of every chance I receive to improve upon myself and to learn from.

I have been working as a systems analyst for the past 3. 5 years with a mutual fund company based out of Boston, MA. I enjoy my work a lot and try my best to strike a balance between work and personal life.

I try to make the most of the summer time by going for hiking trips, going for long walks and long drives. If not outdoors, I enjoy watching comedy movies and reading non-fictions. And... at times just doing nothing on a weekend. I love entertaining and frequently have friends over, with whom I love to sit back, laugh and relax. I love to cook and love it even more when my friends and family enjoy it!

Charity of any kind is very close to my heart and not a day goes by when I am not thankful for the very blessing that allow me a healthy existence and keep those I hold dear in good health.

I am very close to my family and regard family very highly and would like to have a life partner who believes in the same set of values. I look forward to getting to know someone who is simple yet interesting. Down to earth and humourous are crucial. I am in the quest for a good life where I am married to a friend and look to gain a family so each day is truly valued for what it is worth.",35,Kayastha,New Hampshire,,Private Sector,5ft 4in,newf562246,Hindu
"We are a Christian family with a middle class background. This profile is for my daughter and she was born and brought up in Delhi. She is currently employed in a MNC  in Hyderabad.  My son is older to her,  married and  employed with the same company as my daughter. He is currently on an assigment in the US.  My husband retired from Govt service and we are based out of Delhi currently. ",35,Others,"Hyderabad, Andhra Pradesh, India",,MNC,5ft 4in,smarty_78_in,Christian
"Looking for a suitable match for our daughter working as a  councllor Psychologist in the university in North America.Father retired officer from Air Force now working as Senior Captain in the civil Aviation Industry.Mother a house wife. Brother (elder)working for Oracle as project Manager and his wife for a software company.Looking for a suitable match for our daughter,doctorate in Psychology from USA and schooling from Poona India.Diploma in computer annimation and German langguage.",35,Sikh - Jat,"Virginia, Minnesota",,Others,5ft 5in,virf690637,Sikh
My sister is very smart & good looking. She is graduate & fun loving person. She is modest & can be good house wife. She does not prefer to work after marriage. The only thing is that she has white spots on her hands & legs. Although this is a condition of only skin & not a disease. ,35,Sia,"Ratlam, Madhya Pradesh, India",,Not Working,5ft 1in,SMF1515898,Muslim
"She is very caring & understanding. She is soft- spoken & very active. She believes in traditions & family values, at the same time respects good & positive modern day values. She is presently working as a HR cum Sr. Administrative Executive in Korea Based Company in GURGAON. MBA in HRM from Symbiosis Pune, Graduate. 2 and 1/2 Computer Course, ERP and SAP skill, ISO (9001:2008 - QMS skills). She have good Managing Skill (Professional as well as Personal). She is working as a HR cum Sr. Administrative Executive in Korea Based Company in GURGAON. 

",35,Brahmin - Kumoani,"Noida, Uttar Pradesh, India",,MNC,5ft 3in,noif1036713,Hindu
"Hello, I'm a very simple cultured Person who believes in respecting elders and Indian traditional values. For me understanding and honesty is most important than anything else in a relationship and more importantly in a marriage. Two people could be completely different in personalities and tastes but if they understand and respect each other, they could be really potentially ideal life partners. 
",35,Khatri,"Chandigarh, Chandigarh, India",Punjab University,Private Sector,5ft 2in,SMF1549407,Hindu
"Life's a race, in which while we all keep running - While each and everyone of us is capable of leading a life the way we are.... sometimes, i sit back, and think, if even i had someone to talk... to share thoughts, moments, life, or just sweet nothings. Though, i am a strong headed woman, who pretty much knows what she wants from life, still i give up to my humane side, which longs for a companion - a soulmate.... Someone, with whom, i'll live, not just breathe. However, if it is destined, i shall meet the one, who's looking for me.",35,Sikh - Jat,"Delhi, Delhi, India",,,5ft 10in,delf1332822,Sikh
"I am loving, caring, homely at the same time career oriented girl, staying with parents in Navi Mumbai and our ancestral origin is from Karad - Satara - Maharashtra. Having pleasant and attractive personality with good sense of humour, I believe in simplicity, liberal by thoughts and respect moral values and full of life. ",35,Maratha,"Navi Mumbai, Maharashtra, India",Institute of Chartered Accountants of India (ICAI),Private Sector,5ft 4in,navf954621,Hindu
"i am simple looking girl , homely ,with traditional & culture value ,
areas of intrested reading ,listening music and socializing .
well edcucated family with good values and family oriented ,
having no habit of drinking and somking ,  i am lovable and love do surfing ,good at preparing food and fond of eating . preparing traditional food during festivals",35,,"Pune, Maharashtra, India",,,5ft 3in,576638,Buddhist
"Tall, dusky, attractive gal who is addicted to tea and mostly adorned with silver jewellery. Love travelling and a complete foodie (hardcore non-vegetarian and never been scared of trying anything edible so be warned not a regular chicken person)

Fairly ambitious and independent, like to socialize and going out for movies. Thanks to my last job and a bit of travel bug, pretty well travelled across globe for work or leisure in last few years. . 

It?s not easy to find someone with whom who would want to spend your rest of life and who can also be a part of your family. So, its time to try (it?s been sumtime though) if there are still any nice guys left :)

What I am looking for is a good combination of values and outlook; well educated and mature guy who loves life and also knows how to live happily. 

Icing on the cake would be if you are tall (cant help but a tall guy with nice smile and sparkling eyes gets noticed by me quickly though not a mandate as a life partner is a lot more than eyes n smile :p) 

I believe similar interests help but chemistry and connect is all that matters so if you are a decent nice guy who has been busy working all this while and now wants to settle down and I am a bit of something which you are looking for?we can talk more. 

Btw I work with IBM n based out of Gurgaon and stay with my family.",35,Kayastha,"Delhi, Delhi, India",,,5ft 6in,mumf1034498,Hindu
I am  good looking and smart. I  am a dental surgeon & I have also done MBA in HR from PTU. I run my own dental clinic. ,35,Sikh - Arora,"Ludhiana, Punjab, India",,Private Sector,5ft 3in,delf1241926,Sikh
"Simple and caring, positive in attitude, loves traveling, photography, pets, liberal in outlook, value family and relations a lot and looking for a friend cum life partner. She is from a close knitted middle class family. 
",35,Nair,"Bangalore, Karnataka, India",,Private Sector,5ft 5in,SMF1410705,Hindu
"I believe that life is full of twists and turns. Sometimes good sometimes bad... still ""the show must go on""... and nothing should be brought to a standstill. I believe in living life fully, enjoying special moments. Im looking for a sensitive and well-settled guy who gives value to family and friends. I have a strong sense of self and am confident of creating a balance between my professional and family life",35,,,,,5ft 4in,dbisc81347,Hindu
"Travel professional with plans to go the entrepreneurship way. Not much of a Tv person, spiritual but not religious, bookish, loves travelling, adventure. Looking for someone with an open mind, cosmopolitan outlook and similar interset",35,Brahmin,"Rest of Delhi, Delhi, India",,Private Sector,5ft 3in,SMF1558810,Hindu
"Very beautiful, Fair, Slim, Simple, Religious girl with pleasant  nature  and  traditional  values. Presently working in a Law Firm in mumbai. Belongs to a very reputed family of Dhanbad. Two elder sisters married. Elder brother, married, is in Central Govt. Service at Kolkata. Looking for a professionally qualified, well settled boy.",35,Sunni,,,Private Sector,5ft 1in,zainab,Muslim
I am a simple homely girl. I belong to a down to earth family. My father is S.D.O retd. I have one brother. He is married and has two kids.I love my nephews very much.,35,Khatri,"Dharamasala, Himachal Pradesh, India",Other General University,Not Working,5ft 3in,SMF1526883,Hindu
"I am looking for a life partner who is open to life as it unveils. My ideal partner should be caring, adjustable, educated and respects moral and family values. Should be calm, good looking and well settled.",35,Brahmin - Gaur,"Rest of Delhi, Delhi, India",Lucknow University,MNC,5ft 2in,SMF1564858,Hindu
"A human with the right mix of childishness and maturity..... A true taurean, fun-loving, but at the same time can be drop dead serious if the situation demands... A fan of Tom and Jerry, J.K.Rowling, Paulo Coelho,Richard Bach, James Redfield, Louise Hay and Jostein Gaarder....",35,Brahmin,"Painaw / Idukki, Kerala, India","Other College, Mumbai University",Private Sector,5ft 3in,paif1286816,Hindu
"MY DAUGHTER IS A CHARTERED ACCOUNTANT AND WORKING IN MADRAS. SHE HAVE NOW JOINED THE WORLD BANK IN WASHINGTON D.C IN U.S. WE ARE LOOKING FOR A GOOD BOY WITH GOOD QUALIFICATION, GOOD LOOKING AND GOOD FAMILY.
 ",35,Brahmin,"Chennai, Tamil Nadu, India",Institute of Chartered Accountants of India (ICAI),MNC,5ft 4in,chef1173852,Hindu
My Sister is an intelligent and hardworking person. She is a well cultured and family loving. She is very caring. She likes music and dance. Is very honest and enjoys being with friends. She wants to live a happy and peacefull married life.She is beautiful not just by looks but by heart as well.,35,Arora,"Rest of Delhi, Delhi, India",,MNC,5ft 5in,SMF1530338,Hindu
"She is someone with kind heart and head firmly over her shoulders. Well educated, convent educated and blessed with a good communication skill. She is neither introvert nor an extrovert rather someone with a balanced approach. An extremely good cook with a religious bent of mind. Her education has only added to the positives in her personality. She has managed to attain many laurels to her academics. She likes to read fiction and non fiction, a complete movie buff and likes good music. Her smiles always fills us with some kind of energy.",35,Sunni,"Lucknow, Uttar Pradesh, India",,Private Sector,5ft 4in,SMF1466614,Muslim
,35,Brahmin - Kanyakubj,"Delhi, Delhi, India","Guru Gobind Singh Indraprastha University (GGSIPU), Delhi",MNC,5ft 3in,SMF1525805,Hindu
looking for a good looking partner who earns well enough and responsible and loyal. he should be responsible and from a good family background. a caring and loving nature is a must. he should be matching to my profile and all my needs. ,35,Sunni,"Mumbai, Maharashtra, India",,Private Sector,5ft 4in,mumf831310,Muslim
"I prefer a normal partner who is understanding towards me and accept the way I am. We both embark on our journey towards trust, happiness and love.A partner who is open-minded and have a wider perspectives about me.",35,Sindhi,"Delhi, Delhi, India",,,5ft 5in,delf1362649,Hindu
"I am simple and well educated girl, who is looking for caring, loving and understanding life partner with softhearted. I like traveling and cooking. I want my partner to be family oriented and sincere.I m very loving loyal devoted girl looking for a loving, calm n caring partner from delhi chennai or ncr; i ply guitar, and wanna learn music and sitar. I love Bharatnatayam, Carnatic Isai. I'm a lover of Music. I know Tamil and believe in simple marriage. ",35,Khatri,"Delhi, Delhi, India",,Others,5ft 7in,neetubhatia_77,Hindu
"simple girl. love simple and neat, very happy go lucky type, friendly and little bit naughty. loving, caring and straight fwd. Actually if i tell what kind of husband i prefer to.. its not really worked out becos all depend on GOD, but everyone have their dream, so i think he shud be very understanding, becos its a base on every relation ship, i hate liars, he shud knoe how to handle a situation, share everything with me as life partner. open minded, gud thinker, correct me when ever im wrong in a proper way.. becos as a leader he shud know how to make a family to be a happy family and guide thru out my life. i wish that he can be my best friend.",35,Sunni,,,MNC,5ft 4in,sweta_asri,Muslim
"A very down to earth, sensible, sober, god fearing girl, someone who values every moment in life. i love relations and believe that every relation involves mutual reciprocation. Relationships-of all kinds-are like sand held in your hand. Held loosely, with an open hand, the sand remains where it is. The minute you close your hand and squeeze tightly to hold on, the sand trickles through your fingers. You may hold onto some of it, but most will be spilled. A relationship is like that. Held loosely, with respect and freedom for the other person, it is likely to remain intact. But hold too tightly, too possessively, and the relationship slips away and is lost, looking forward for a blissful relationship of love, trust and compatibility.",35,Sikh - Ramdasia,"Chandigarh, Chandigarh, India",Punjab University,State Government,5ft 4in,SMF1527513,Sikh
"Very fair (Milky Colour), Body Slim
Extremely Beautiful,attractive,Dont Wear Spectacles,Caste  Tomar Thakur (Rajput) Gotra-Atri.
Hobbies:  Reading,",35,Rajput,"Faridabad, Haryana, India",,,5ft 7in,harf661396,Hindu
"My name is Kasthuri. I'm 34 years old and a divorce with no child. I'm an understanding and open-minded person. My friends will describe me as a frindly person. I like to listen music during my free time. I would like to find an understanding, open-minded and a frindly life partner. ",35,Gounder,"Kuala Lumpur, Kuala Lumpur",,Private Sector,5ft 7in,SMF1494388,Hindu
"I am Poonam Saxena. i don't no how to express myself. About my soul mate he must be very much true with me. should be understanding, who cares me and my Family. ",35,Kayastha,"Nagpur, Maharashtra, India",,Private Sector,5ft 1in,nagf1240686,Hindu
"She is a simple, loving, caring, down to earth and a person who is close to the family. She has done her schooling from Kendriya Vidhyalaya around many places in India because her father was in the Army. She completed her Bachelors in Arts in Geography and Economics from Dharamshala (Himachal Pradesh) and continued her education doing MBA in Marketing and Systems from Vishakapatnam (Andra Pradesh). Worked with many companies earlier and now working with WNS at Pune (Maharashtra), which deals with Tavelocity. She is more inclined towards spirituality and natural healing like angelic communication, EFT and is also a advanced Pranic Healer. ",35,Brahmin,"Pune, Maharashtra, India",,Private Sector,5ft 8in,punf328745,Hindu
"She is smart, outgoing, outspoken, friendly, vivacious and dynamic, who likes to travel and visit places; and make new friends. In her free time she would either go to gym or for yoga. She is as an architect by profession and is working for a real-estate firm with clients who are generally based abroad. A good person with a great sense of humour, she is a wonderful person to be with. She is very close to her family. ",35,Protestant,"Delhi, Delhi, India","Birla Institute of Technology (BITS), Mesra",Private Sector,5ft 3in,SMF1428148,Christian
"Simple, Down to earth girl brought up in good family which is bond by family values. I am looking forward to meet someone who is on my wavelength, with whom  I can connect with, and if I do meet up with my soul mate, I can assure you that he will be getting a real deal, as honesty is one of my strongest characteristics. I am a confident and well accomplished woman, sure of myself and my roots. I'm looking for a well settled match, form a respectable family and who gives value to our culture. ",35,Catholic,"Mumbai, Maharashtra, India",,Private Sector,5ft 1in,mumb0706,Christian
"I am a very candid person, and take things as they come. I am an honest, straight forward, ambitious and fun loving person. I believe in fidelity in relationships. I inhabit values of modern times, along with cultural & traditional values of my family. I believe in simplicity and appreciate things which are conveyed in most natural manner. I am always ready to take up challenges and explore life to the extreme with my optimistic view point as my strength.  and I do inculcate it in my personal as well as professional life.",35,Lingayath,"Bangalore, Karnataka, India",,Private Sector,5ft,banf1364424,Hindu
"Education - BE (Computers), MBA (International Business)[Distance learning]; Currently working in IT MNC at Pune as Project Manager. Hobbies - Reading, Listening music, dancing, singing, visiting places, arts & crafts. I am a very friendly person by nature and believe trust is the basis of any relationship. I am passionate about everything I do in my life and believe in living life to the fullest. I am brought up with strong cultural and family values. I am very adaptive and mix well with everyone. I am a person of principles & morals and strongly abide the same. I am very straightforward and optimist person.
Caring, humorous, confident, sensitive, spiritual, smart, a bit short tempered.",35,Swakula Sali,"Mumbai, Maharashtra, India","ICFAI, Hyderabad",Private Sector,5ft 2in,perfect_pair_in,Hindu
"I am simple, adjusting and down to earth person. ",35,Reddy,"Nellore, Andhra Pradesh, India",Hyderabad University,Not Working,5ft 2in,SMF1515471,Hindu
