aboutText,age,caste,city,college,employedIn,height,profileID,religion
"This is Divya, happy going and simple, i am an adventurous and carrier specific girl, like to photography and painting and don't like people who is not outspoken and specifically diplomats. ",23,Kashyap,"Delhi, Delhi, India",Delhi University,MNC,5ft 1in,SMF1491883,Hindu
mmmmmmmmmmmmmmmmmmmmmmmmmmmmmmmmmmmmmmmmmmmmmmmmmmmmmmmmmmmmmmmmmmmmmmmmmmmmmmmmmmmmmmmmmmmmmmmmmmmmmmmmmmmmmmmmmmmmmmmmmmmmmmmmmmmmmmmmmmmmmmmmmmmmmmmmmmmmmmmmmmmmmmmmmmmmmmmmmmmmmmmmmmmmmmmmmmmmmmmmmmmmmmmmmmmmmmmmmmmmmmmmmmmmmmmmm,23,Brahmin,"Citronelle, Alabama",Agra University,MNC,6ft 3in,SMF1664515,Hindu
"Simple, Confident, Beautiful girl with great sense of humor. Responsible, caring and simple personality. Like hanging out with friends and family and reading books. Looking for a genuine guy who is down to earth, caring and a fun loving person.",23,Sunni,"Bangalore, Karnataka, India",,MNC,5ft 11in,SMF1641645,Muslim
My daughter is independent and family oriented girl. She is career oriented and has family values. She very much like teaching and teach many kids. ,23,Naidu,"Bangalore, Karnataka, India","Visveswaraiah Technological University, Karnataka",Private Sector,5ft 3in,SMF1564172,Hindu
"Hi my name is nainasharma.I am pursuing MBA from IMT ghaziabad and i am run tuition classes in my home. My father is a govt. employee in (DP)and my mother is a house wife ,my brother is doing job in IBM company",23,Brahmin,"Delhi, Delhi, India","IMT, Ghaziabad",Not Working,5ft 2in,SMF1565186,Hindu
"She is a very simple, good looking, caring and a homely girl. she is a perfect blend of traditional and modern values. she is pursuing MA in english and want to become a english lecturer.",23,Jat,"Rohtak, Haryana, India",,Not Working,5ft 4in,SMF1520228,Hindu
"Hi, am Ashwini Agawane, lives in Mumbia (Thane). Belongs from a joint family having 2 brothers, one is married and other is doing Degree in M.tech Engineering, my father have his own business and mother is a housewife. ",23,Chambhar,"Thane, Maharashtra, India","Other College, Mumbai University",Private Sector,5ft 2in,SMF1608856,Hindu
"Hi, i am a simple girl with modern thoughts, confident but not overconfident. I Wish all the people in the world will be happy.",23,Baniya,"Delhi, Delhi, India",Delhi University,Private Sector,5ft 2in,SMF1577831,Hindu
"My daughter is pretty distinguished person. She is a beautiful girl, a bright student and an outgoing person who is well admired and is yet equally homely and a humble human. 

",23,Shewetamber,"Jodhpur, Rajasthan, India",,Not Working,5ft 7in,SMF1551397,Jain
"She is a very loving, caring and understandable person and looking for a similar person who will be free minded partner for her and should be well settled, hard working, ambitious guy with value for relations.",23,Telugu,"Aurangabad, Maharashtra, India",Other General University,Not Working,5ft 1in,SMF1615233,Hindu
"My daughter is a very decent, intelligent and understanding girl who believes in god and family values. We are looking for a well educated and cultured person for her having respect for family and is loyal.",23,Kashyap,"Delhi, Delhi, India","Other College, Delhi University",Not Working,5ft 4in,SMF1587978,Hindu
"My sister is sweet and simple, loves listening to music. She provides tuition to primary school students up to class 8th and working as contract primary teacher in Navyug School Educational Society. Pursuing graduation from Delhi University, have done Elementary Teacher Education course from DIET, Moti Bagh New Delhi. ",23,Brahmin,"Delhi, Delhi, India",Delhi University,Others,5ft 6in,SMF1561065,Hindu
"i m khushbu; am a vegetarian; have one brother and one sister, my sister was married in 2005. my brother is a yoga teacher. he is in Patna. brother was married in 2009. he is professionally yoga trainer",23,Gupta,"Patna, Bihar, India",Indira Gandhi National Open University (IGNOU),Private Sector,5ft 5in,SMF1496839,Hindu
"I am doing internship. Will start PG shortly. I have given NEET exam. I am fond of Painting, singing,reading. I am seeking for a life partner who is doing MD/MS or who has completed MD/MS My father is doctor.",23,Shewetamber,"Bhavnagar, Gujarat, India",Gujarat University,State Government,5ft 4in,SMF1569974,Jain
"I am  a very humble, caring and loving person who loves spending leisure time listening to music.",23,Baniya,"Delhi, Delhi, India","Other College, Delhi University",Private Sector,5ft 8in,SMF1621268,Hindu
"She is smart, lovely girl with pleasant personality. She is sincere, honest and intelligent. She likes dancing, music. Also learning to play guitar. She likes socializing. She has good and caring nature.",23,Shewetamber,"Jaipur, Rajasthan, India",Institute of Chartered Accountants of India (ICAI),Not Working,5ft 4in,SMF1546892,Jain
"I am a conventional girl coming from a traditional family with balanced values. I believe in almighty God. I love to enjoy the simplest joys of life & feel that the simplest things are the one's that leave an indelible impression in the mind. Reading / Writing energizes me. Cooking thrills me, Listening to Music Refreshes me and Travelling Enlightens me. Unmarried Well Educated & Well Settled Match - The ideal person for me would be somebody who is Down to Earth, has a Good sense of Humors and respects and values human relations.",23,Thakur,,,Private Sector,5ft 3in,SMF1520162,Hindu
"My Daughter has a very charming personality with a positive attitude in life. She is a fun loving girl who loves to do creativity. She has completed (B.Sc) and GNIIT in Software Engineering. Now Working in Ashish Inter build India Pvt Ltd as a Web Developer. Her father got retired from Indian navy as Hon. SLT. at Mumbai. Her mother is a house wife (B.Sc). Her brother has completed B.E from pune university and working Mumbai in HCL. 

",23,Kashyap,"Hajipur, Bihar, India","Other College, Mumbai University",Private Sector,5ft 4in,SMF1543061,Hindu
"Simple person & love for my family; my partner should be loving person with no bad habits. 
",23,Chaudary,"Patna, Bihar, India",Other General University,Not Working,5ft 3in,SMF1517520,Hindu
Myself Raman and am from Chandigarh. Am a BCA graduate from Punjab university and working as a Special Educator for mentally challenged children. Find interest in painting and dancing.,23,Sikh - Saini,"Chandigarh, Chandigarh, India",Punjab University,Public Sector,5ft 4in,SMF1625062,Sikh
"Hi, I am Bhavani, I have created this profile for my elder sister Divya. Telling about Divya (as a human being not as her sister). The person who is searching for a good wife or good daughter in law or sis in law then i am sure you clicked on aright profile, yes undoubtedly. she is very good heart and little emotional, sentimental. She has a sacrificing nature she sacrificed her whole teenage for our family. As my father is expired 8 years back, she stood as the head of the family, she started working at the age of 15 years as a sales girl in a toys shop and now she is a beauty adviser (sales adviser) for olay cosmetics. She can do anything for others happiness not only for family, even for friends, neighbors, relatives and strangers also, even now she is not ready for marriage as she wants us to be settled in our lives and then get married. Really she is very sweet, so now i am searching for a good brother in law who can take care of my sis as a kid and give her that happiness which she missed in her teenage. Last point we cannot afford dowry, so the person who is willing to marry her without dowry is preferable.",23,Munnuru Kapu,"Hyderabad, Andhra Pradesh, India","Other College, Osmania University, Hyderabad",Private Sector,5ft 4in,SMF1494250,Hindu
"My daughter is a very loving, humble, good looking, and a God fearing girl who is also willing to pursue in her career. When it comes to family she is understanding, adaptable and responsible. She is modern, yet values culture and tradition. Most importantly she has strong, and immovable faith in Christ.",23,Catholic,"Chennai, Tamil Nadu, India",Anna University,Not Working,5ft 7in,SMF1648553,Christian
"My daughter is smart, ambitious, well mannered with positive attitude. Her key attributes are social nature, persistence, responsible, courteous, and respectful. She has a mature outlook towards life while maintaining a good sense of humour. 
",23,Brahmin,"Delhi, Delhi, India",,Not Working,5ft 5in,SMF1542492,Hindu
"Born and brought up in Maharashtra, Aishwarya's formative years had the blend of traditional & modern values. She is a beautiful, sensitive, homely, responsible & caring individual, who values relationships. She has learn Carnatic music, & is passionate about photography, painting, cooking, traveling & social service. She has finished with MBA, and is awaiting her results. She plans to start working shortly. Having stayed in Pune and exposed to various cultures, all her life, she would prefer someone who has been raised in a similar environment. We believe that the horoscopes should be compatible, but we equally believe in the matching of minds. ",23,Brahmin - Iyer,"Pune, Maharashtra, India",,Not Working,5ft 4in,SMF1653192,Hindu
"i belong to a middle class agricultural background family.i am hard working,loving,caring girl brought up in joint family.Cooking and reading books are my hobbies.I am interested in pursuing higher education.Right now i am doing M.Com ist year at Amritsar",23,Sikh - Jat,"Gurdaspur, Punjab, India",Punjab University,Not Working,5ft 6in,SMF1595582,Sikh
,23,Yadav,"Delhi, Delhi, India",,Not Working,5ft 2in,SMF1656703,Hindu
I am an understanding person with a positive disposition.,23,Swakula Sali,"Navi Mumbai, Maharashtra, India",,Private Sector,5ft 6in,SMF1568875,Hindu
We are a middle class nuclear family settled in Delhi - NCR region for last 18 years. We belongs to western UP. We are looking for a suitable compatible match for our daughter who is a fashion designer and is employed in a Export House.  ,23,Baniya,"Ghaziabad, Uttar Pradesh, India",National Institute of Fashion Technology (NIFT),Private Sector,5ft 2in,SMF1595280,Hindu
"I am looking for a suitable match for my sister-in-law. She is a well educated, caring and broad-minded individual. Her father is a Senior Government official and mother is a Teacher. Suitable match should be independent, well educated and from a well-educated family. ",23,Khatri,"Delhi, Delhi, India",,MNC,5ft 4in,SMF1630514,Hindu
"we are currently living in Delhi, but we are from Kollam Dist. I believe in simple living and thinking. I am a fun loving, happily always think to do something new to make life energetic. My family is a nuclear family. My father is a manager in a pvt firm, my mother is a housewife, i have a sister and she is married, her husband works in Delhi Metro and she is having a baby also they are settled in Delhi. ",23,Nair,"Delhi, Delhi, India",Manipal University,Private Sector,5ft 4in,SMF1465194,Hindu
"I'm fun loving, simple, sweet girl. I like small things and want my would be partner should respect and care of me n my family too. I love to roam around, i love my family, friends. I want my would be partner also be like me.",23,Kamboj,"Faridabad, Haryana, India",Others,Private Sector,5ft 3in,SMF1494558,Hindu
"I am a very simple and nice girl, love my parents so much. My hobbies are dancing, singing, traveling & enjoying every moment of my life. ",23,Digambar,"Jaipur, Rajasthan, India",Institute of Company Secretaries of India (ICSI),Private Sector,5ft 5in,SMF1649279,Jain
"Assalam Wallikum, i am Shihan, wish to be happy always. ",23,Sunni,"Chikmagalur, Karnataka, India",Karanataka University,MNC,5ft 6in,SMF1655741,Muslim
She is the 2nd daughter of our family. Is very good looking and attached to family. ,23,,"Coimbatore, Tamil Nadu, India",,,5ft 4in,SMF1644433,Hindu
Simple and fun loving person. Looking for a groom belongs to Bairwa caste and he must be well qualified with good job and family. ,23,Scheduled Caste,"Kota, Rajasthan, India",Other General University,Not Working,5ft 2in,SMF1593489,Hindu
"She has just completed BCA from Bangalore University and placed in a reputed MNC in Bangalore. She is a very lively, confident and responsible girl. She is passionate about whatever she does in life whether it be cooking a meal, dress designing, solving a puzzle or taking care of her little pet. She does it all with dedication and concern. Our parents have taught us the importance of respecting elders, loving the young ones and having a feeling of compassion for everybody. We firmly believe that it is important to imbibe the values of Islam is our lives. Ours is not a very orthodox family, but we stick to the basic five pillars of Islam and we feel it is very important for the prospective groom to have the same views. My sister is a perfect blend of tradition and modernity. Whether it be dressing up for a typical muslim wedding or an office meeting, she knows how to carry herself well. She is very emotional when it comes it relations, we would expect the groom to be kind and caring. We are looking for somebody who can take care of my little sister well, somebody who understands his responsibilities and respects women.",23,Sunni,"Bangalore, Karnataka, India",,MNC,5ft 5in,SMF1488457,Muslim
"My father is a business men, my mother is house wife. We are 3 sisters and 1 brother. We are living in a joint family. Am well versed with stitching, computer, dancing, cooking and drawing. My hobbies are reading newspaper and magazine, watching TV, listening music. Am handicapped by ears and tongue but can read and understand lip movement. ",23,Gupta,"Panipat, Haryana, India",,Not Working,5ft 6in,SMF1576096,Hindu
"Presently, my Daughter is studying MCA final year (will complete by May 2014) in Coimbatore. She is well balanced & homely in nature and willing to follow Iyengar traditions. Her mind set is to respect a human being irrespective of their Religion or Caste.",23,Brahmin - Iyengar,"Chennai, Tamil Nadu, India",,Not Working,5ft 4in,SMF1535188,Hindu
"ssssssssssssssssssssssssssssssssssssssssssssssssssssssssssssssssssssssssssssssssssssssssssssssssssssssssssssssssssssWrite about yourself, your likes and dislikes, personality and traits, aspirations in life, unique characteristics, etc.",23,Rajput,"Amritsar, Punjab, India",Agra University,Not Working,4ft 10in,SMF1654489,Hindu
"I WANT TO HAVE A GOOD LIFE PARTNER, who can take care of me, love me a lot and understand me. I love my family a lot. I like to go on long drives with my partner, my hobbies are listening to songs and gossips with my friends.   ",23,Agarwal,"Amravati, Maharashtra, India",Other General University,Private Sector,5ft 4in,SMF1450919,Hindu
"I am Kavitha Rajendran, a technical analyst living in Chennai. I would like to find a life partner who is fun loving, kind, jovial and simple. I am looking for a boy who is professionally employed. He should be of the same cast as me. My parents are working in Pondicherry and my brother is doing MBA in Pondicherry University.",23,Others,"Rest of Pondicherry, Pondicherry, India",Anna University,Private Sector,5ft 2in,SMF1492804,Christian
"I am a simple, down to earth person and do believe in moral and ethical values.
",23,Brahmin - Gaur,"Gurgaon, Haryana, India",,MNC,5ft 8in,SMF1536785,Hindu
"My sister has completed her B.E, CSE from Anna University, Chennai. She is very intelligent, is very sincere, well disciplined, hard-working and punctual.
",23,Jat,"Hyderabad, Andhra Pradesh, India",Anna University,MNC,5ft 9in,SMF1610122,Hindu
"I am a person with versatility and prefer solitary lairs.. Boring,impossible,bad are a few words one will not find in my dictionary.Till today i have never left any stone of failure unturned into a booming success.i love sophistication and get irritated easily by manner less acts....that's how i am....i believe in dreaming and working towards fulfilling them....my mantra in life is dream big,work hard,love what you do and the most important love and live to the fullest.",23,Padmasali,"Mumbai, Maharashtra, India",IIT Mumbai,Not Working,5ft 6in,SMF1447014,Hindu
"SHE IS A FROM RESPECTABLE FAMILY. SHE IS VERY BEAUTIFUL, FAITHFUL AND RESPECTABLE PERSON. ",23,Sunni,"Hyderabad, Andhra Pradesh, India",Osmania University,Private Sector,5ft 6in,SMF1562562,Muslim
"I have done BE from Mumbai University and planning to do MBA and also looking for a job. Love reading, listening to music and dancing. Enjoy doing creative works. I have a family of five people that includes one younger brother, sister, mother, who is a housewife and father works in GAIL, Mumbai. ",23,Koshti,"Mumbai, Maharashtra, India",Other General University,Not Working,5ft 1in,SMF1626079,Hindu
"i am a simple n sweet girl... who believes in simplicity.. love watching movies, listening songs, long rides, net surfing, hanging out wid frnds... i am a big foodie... 

",23,Protestant,"Nagpur, Maharashtra, India",,Not Working,5ft 4in,SMF1443906,Christian
Am a simple living girl having five members in the family. My father have a business and mother is a housewife. Have one younger brother and he is doing job. ,23,Brahmin - Tyagi,"Delhi, Delhi, India",Indira Gandhi National Open University (IGNOU),Not Working,5ft 3in,SMF1628198,Hindu
"About Parul AK Jain, she is too much hardworking and career as well as family oriented girl, having good academics. She got several awards from MP government for being topper in whole m.p university level at 1st position and got cash award too of 20000 and she was topper of collage also in last semester. Now, she is having last exam of 8th semester till 27th may, then she is having offers from good companies and she can join their in Indore, Ahmadabad, Anadpur, Bhopal and Hyderabad. ",23,Digambar,"Vidisha, Madhya Pradesh, India",Other General University,Private Sector,5ft 3in,SMF1622713,Jain
"My sister Sapna, a Microbiologist, living in Hosur. Looking for a person who is living, preferably in Bangalore, either a Doctor/ Engineer or Software Professional. Sapna is a fun loving & caring girl. ",23,,"Bangalore, Karnataka, India",Anna University,Private Sector,5ft 7in,SMF1603977,Hindu
"I am a social person, confident enough and honest. As I believe in being ground to earth and to be friend to everyone in my life. By God's grace I have family which is very open minded and friendly and I tend to expect similar family. I would want to have a life partner who is honest.",23,Maratha,"Pune, Maharashtra, India",University College of London,Private Sector,5ft 4in,SMF1507415,Hindu
She is very fair and smart.,23,Maheshwari,"Sangli, Maharashtra, India","Shivaji University, Maharashtra",Not Working,5ft 6in,SMF1590290,Hindu
"Hello, I m a very simple cultured girl who believes in respecting elders and Indian traditional values. For me understanding and honesty is most important than anything else in a relationship and more importantly in a marriage.",23,Agarwal,,Institute of Company Secretaries of India (ICSI),Not Working,5ft 6in,SMF1527547,Hindu
"Recently, I have study my MBA (HRM)from Symbiosis distance learning course. I want my partner will be well established & educated too. My partner would be engineer or CA or Business man. He would neither smoking nor use a tobaco product & also would be vegetarian. He would be good looking.  
 ",23,Shewetamber,"Surendranagar, Gujarat, India","Symbiosis Institute of Business Management (SIBM), Pune",Not Working,5ft 4in,SMF1527560,Jain
"We stay in Mumbai. Daughter working as an Hr in an MNC & pursuing MBA. Is a family oriented, adjustable, good, strong, worthy person with good human values in life and helpful in nature. Father works in Railway as ssc & Mother is housewife and Brother is studying. ",23,Kayastha,"Mumbai, Maharashtra, India",Mumbai University,Private Sector,5ft 5in,SMF1508355,Hindu
"I am the youngest daughter with two elder brothers. Eldest brother is married and the second elder brother is unmarried. Both of them are currently employed. I am currently pursuing my MSc. In Dietetic & Food Service Management (MSc. DFSM). My parents are simple people, my mother being a housewife and my father works for a construction company. We stay in a joint family and by the grace of Allah they have brought all of us (sisters) with good Islamic values and helped us getting the best education possible. ",23,Sunni,"Mumbai, Maharashtra, India",Mumbai University,Not Working,5ft 2in,SMF1535645,Muslim
My daughter is quite and responsible girl having traditional values and devotional too. ,23,Vishwakarma,"Pune, Maharashtra, India",Other General University,Not Working,5ft 6in,SMF1638432,Hindu
"I AM SIMPLE AND DOWN TO EARTH PERSON. MY INTERESTS INCLUDE EXPLORING NEW THINGS, DRIVING,TRAVELLING AND COOKING. I BELIEVE IN SIMPLE LIVING AND HIGH THINKING. I MAKE MY SURROUNDINGS FILL WITH HAPPINESS AND LOVE. ",23,Agarwal,"Delhi, Delhi, India",,Not Working,5ft 4in,SMF1556828,Hindu
"A smart, fair complexioned and beautiful girl with excellent family and gursikh values. She is God fearing, caring, extremely friendly and sociable. A confident and lively person she loves to make friends. She is fond of traveling, listening to music and reading. She loves nature and is a creative person with varied interests.",23,Sikh - Khatri,"Delhi, Delhi, India","Symbiosis Institute of Business Management (SIBM), Pune",Not Working,5ft 5in,SMF1525336,Sikh
I am looking out for a groom for my niece. He should be highly qualified from a respectable Muslim Shia family. My neice is presently in the final semester of MBA in Indore. Her father is a Mechanical Engineer. She has only one brother and no sister. She is the eldest child of her parents.,23,Sia,"Indore, Madhya Pradesh, India",,Not Working,5ft 3in,SMF1538741,Muslim
"I am simple, honest and hardworking girl. I am open to liberal thinking. Born and raised in middle class family. Am a bit shy and reticent type of a girl. ",23,Scheduled Tribe,"Ranchi, Jharkhand, India",,Not Working,5ft 5in,SMF1585153,Hindu
"Me smart, straight forward, believe in myself, modern and loyal person. Wants a groom who is intelligent, smart, loyal, respect me & my family, is straight forward, frank and handsome, having some ethics and should be cooperative.",23,Kori,"Bhopal, Madhya Pradesh, India",,Not Working,5ft 3in,SMF1576849,Hindu
"Jyoti thakur from Chandigarh, sweet by nature, lives in Chandigarh with my family. Like to do fun with friends, a web designer working in I.T Company in Mohali and believe in god. ",23,Rajput,"Chandigarh, Chandigarh, India",,Private Sector,5ft 6in,SMF1596115,Hindu
She is a EEE & now doing MS in Michigan University. Graduation by Apr 2013. Would like to pursue a balanced life both personal and professional. Easy going by nature and would like to achieve and sustain a happy family life giving respect to elders and family members.,23,Vishwakarma,"Ann Arbor, Michigan","Birla Institute of Technology (BITS), Pilani",Not Working,5ft 4in,SMF1542507,Hindu
"I am simple, understanding and practical person with positive outlook. Respect Indian tradition and values ethical values. Honest, loyal with straight forward attitude, Supportive and co-operative too. As far as marriage is considered i trust and respect this institution. Father is a retired Army JCO and presently working with Torrent power Ltd as HR & security officer in Ahmadabad, mother is a sweet housewife, Younger sister study in MSU baroda. ",23,Rajput,"Sitamarhi, Bihar, India",Allahabad University,Not Working,5ft 3in,SMF1536182,Hindu
"I'm a simple girl with all the good values and humanity. I'm frank and straight forward person and like painting, music and dance.",23,Catholic,"Chennai, Tamil Nadu, India",Other General University,Not Working,5ft 4in,SMF1432835,Christian
I hate lies and cheaters. Looking for someone trustworthy and caring partner. I am currently working as a 2nd year student pursuing my degree in Software Engineering. ,23,Protestant,"Evans, Georgia",,Not Working,5ft 3in,SMF1578368,Christian
"i am decent, clam, kind, honest, trustworthy and devotional kind of person, i give value to moral preaching and love and respect my family very much and wants a person in my life who can respect my this feelings and regards towards my family. ",23,Rajput,"Indore, Madhya Pradesh, India","Devi Ahilya University (DAVV), Indore",Private Sector,5ft 5in,SMF1418192,Hindu
"Pavitra is good-looking, tall, down to earth, confident person belonging to a well-respected family. She believes in living in the present but with an eye on the future and enjoying every moment of her life. She is 22 years of age and carries herself with immense grace and poise. She has received her formal education in Dar es Salaam in Tanzania and Pune in India and hence brought up in a multicultural environment. She has completed her BE in Electronics and Telecommunication from PICT, Pune. She has been placed in a fortune 100 leading business house in India. Her passion is to travel and try new cuisines. She loves to socialize and meet new people. She loves to play badminton and chess. She has learnt Bharathnatyam in her early years. She loves pets.",23,Brahmin - Iyengar,"Pune, Maharashtra, India",Pune University,Private Sector,5ft 7in,SMF1521709,Hindu
,23,Rajput,"Ambala, Haryana, India",Banaras Hindu University,Not Working,4ft 11in,SMF1649693,Hindu
"I am Ashwini Jirange. I live in one of the most beautiful cities of India, Mumbai. My life and my self are not really limited to one thing or aspect. I love to learn new things, expanding my horizon of knowledge in every aspect. Life is so short and this world is so big. There is so much out there to learn.  ",23,Bhovi,"Thane, Maharashtra, India",,Private Sector,5ft 5in,SMF1582231,Hindu
