aboutText,age,caste,city,college,employedIn,height,profileID,religion
"Hi, I am Razia, like to read books and cooking, watching birds; don't like lies and dishonesty. I am very shy in nature. ",42,,"Kolkata, West Bengal, India",,,5ft 3in,othf513918,Muslim
"I 'm a very positive person and love to take everything in my stride as it comes. I am a hard worker and definitely justify my professionalism when required. But on the other hand, I also strike a perfect balance with my personal and professional life.  Loving and caring person this is what others say about me. Relationship for me is a start of a good friendship which when compatible turns into love. So IÂ’m hoping to meet my better half who can complement me in every way.",42,,,,,5ft,mumb30031,Hindu
"I am a s/w professional, a career woman, fun loving with a good sense of humor, though been in Chennai for more 3 decades now, have had my share of traveling round the world. Interested in challenges and takes life as it comes.",42,Brahmin,"Chennai, Tamil Nadu, India","Bharathiar University, Tamil Nadu",Private Sector,5ft 6in,SMF1577469,Hindu
My sister is an educated and homely girl. She is loving and caring and loves nature. Her hobby is gardening. She likes traveling and very responsible. She loves music and very family oriented.,42,Others,"Delhi, Delhi, India",,Others,5ft 3in,delf898243,Muslim
"This profile is created by the girls sister. 
All I can say is that the guy she marries will be an extremely happy person to be married to her. Shes a soft spoken sensitive person yet has a dynamic personality. 
She is currently working as an Operations Head in an ITES Training & Recruitment company in Bangalore. 
Very professional, a perfectionist and a hard worker, she's gorgeous looking and a cheerful person. She loves her family and has always been an asset to the family. She's talented, paints and sings very well and is very spiritual as a person. A regular yoga practitioner she is conscious of her health. 
She looks forward to marry a person (never married only & upto 39 yrs of age) who is cheerful, full of life, one who respects her & her family. He should be highly qualified and a thorough professional. He should be honest, sincere & highly committed.",42,,,,Private Sector,5ft 4in,sept1971,Hindu
"I 'm a very positive person and love to take everything in my stride as it comes. I am a hard worker and definitely justify my professionalism when required.But on the other hand, I also strike a perfect balance with my personal and professional life.  Loving and caring person this is what others say about me. Relationship for me is a start of a good friendship which when compatible turns into love. So IÂ’m hoping to meet my better half who can complement me in every way. 
",42,Kannada Mogaveera,"Mumbai, Maharashtra, India",,,5ft 4in,tmc2c1268,Hindu
"Simple, good looking, fair girl looking for a professional match. I like reading and doing yoga. Boy is settled in India or abroad. Would prefer an early marriage. Ours is a well educated family settled near Chandigarh. 
",42,Khatri,"Chandigarh, Chandigarh, India",,Others,5ft 3in,SMF1574886,Hindu
"Am happily  married, staying with my hubby. Have 2 kids. Am looking for a good nature man who is a widower with jovial nature for my 64 yrs mom. as i feel at this age one requires a companion to share, happiness and sorrows. all i want is that my mom who has always done a ot for everyone deserves her share for happiness too.  ",42,,"Kolkata, West Bengal, India",,Others,5ft 2in,SMF1532536,Hindu
"I am an open minded girl, blessed with the quality to blend in all kinds of atmosphere as i have been nurtured to understand the values of traditional life style of living with the mindset of liberal & modern. I value my traditions to full length as i have a closed knit family of all the relatives who respect the freedom and opinion of the individual. This kind of lifestyle has given me freedom to express my individual ideas keeping in view respect of elders around me.",42,Brahmin,"Lucknow, Uttar Pradesh, India",Lucknow University,Private Sector,5ft 3in,lucf1086194,Hindu
"Hi, i have completed my B.Sc (Science) in agriculture. I am currently running my own business.  I like singing, dancing, reading, painting in my leisure time. I am a honest, caring and charming. ",42,Kamma,"Coimbatore, Tamil Nadu, India",,,5ft 5in,coif551683,Hindu
"she is very simple, beautiful ,looks much younger to her age.  ,religious, fun loving. she is looking for someone, who is very simple, religous, fun loving preferably a widower or divorsee living in hyderabad. He should treat her like a friend too apart fromlife partner so that she can share her sorrows and happiness",42,Sunni,"Hyderabad, Andhra Pradesh, India",,,5ft 4in,fatima_hyd,Muslim
,42,Balija,"Delhi, Delhi, India",,,5ft 3in,raashmirao,Hindu
"I'm a very down to earth person,very adventurous,head strong, love having fun & very lively. I come from a family which believes in strong family ties,love & support.Trust & Faith in God is my solid background. I want to find someone who can share my joys, sorrows & be a true & faithful companion for the rest of my entire life.",42,Protestant,"Shillong, Meghalaya, India",,MNC,5ft 3in,visf199075,Christian
"Born and brought in mumbai, educated in marathi medium. Completed B.Ed, Beautician course and work on it.
I am looking for a modern, independent, attractive partner who also has a good sense of humour. Personally I have a face for every occasion since I can blend in with the crowd. I am a person who is very caring, loving, compassionate, considerate, cheerful, optimistic, calm, soft-spoken, strong-willed, and persevering. I m looking for a person who should be well settled and gives equal importance to work and family.",42,Mala,"Mumbai, Maharashtra, India",,Private Sector,5ft,madbat1802,Hindu
"Hi, I'm very god fearing person, very much pratical, optimistic, with positive attitude, very easy going as lifes comes to me.Believe in give respect and vice a versa ,very responsible person. believe in spirutality and very fun loving in nature. i do respect marriage, its not the meeting of two bodies physically but meeting of two souls in one,  i personally believe partner should be more as a friend than a partner why becoz friends are much open, free, frankly honest, so there will be much more compatibility and understanding between the two.",42,Sindhi,"Thane, Maharashtra, India",,,5ft 4in,mumf764598,Hindu
"looking for someone whom life frequency can be tuned beatifully and see the rainbow colors of life together holding hands till death makes us apart.Expect the care and respect a women would like ,nest a shelter where birdy can be fly and be cozy. together we can see the world not with 4 but 2 eyes.proud to be best couple in every manner.yes alrounder.",42,,,,Private Sector,5ft 1in,nillibilli,Hindu
"I am looking for someone who is  genuine & has a good heart. Enjoys the finer things in life. Has a good sense of humor and has a beautiful smile. Looks are not the most important thing to me, its your personality and what you have to offer inside is more important. I enjoy to swim, going to the movies, listening to music, dining, go for walks along the beach & travel.
My career is very important for me in life right now till I find that special someone. I love to travel been to many destinations. Want to go places with that special one. I prefer someone who is there own self and make there own decisions without influencing others.",42,,"Sydney, New South Wales",,Public Sector,5ft 7in,lookingforgroom_1,Christian
"i am a very polite person much interested in reading, listening to music, like to  explorethe world with fun n love n also interested in tamil and studies of my own.",42,Nadar,"Rest of Tamil Nadu, Tamil Nadu, India",,Private Sector,5ft,jeya,Hindu
"I m fair, thin & tall. Fun loving, caring, smart & little but shy. Working in Telecom company in Pune. Like to live life peacefully without disturbing anybody with love & care for eachother in the family. To become financially sound & try to go ahead & get good position at work/job. My father is a retired Highschool Teacher & mother is housewife. Three sisters. All are married. All family members at Solapur. Wellknown & educated family. My partner should be frank, understandable, loving, caring & friendly. He should treat me as a friend. He should not be narrow minded. He should be broad minded. Well settled. Financially sound enough. He should be well educated & having nice attitude.",42,,"Pune, Maharashtra, India",,,5ft 6in,anjurutu,Hindu
"I want to start my married life again, looking for a person who is true, kind, loving and trustworthy, independent minded and broad minded, i love to spend more time with family at home and I am simple and God-fearing. ",42,Catholic,"Mumbai, Maharashtra, India",,Private Sector,5ft 4in,SMF1564819,Christian
"She is good looking, economically independent, and takes interest in every part and keen to learn new things. She also an avid reader, watches Tv, surfs the net at times.",42,Ramgariah,"Dehradun, Uttaranchal, India",,Private Sector,5ft 2in,dehf147636,Sikh
"A simple person, working for a financial multinational company in Mumbai. Being responsible and caring comes naturally to me; have looked after my family since my moms early death; Having seen life closely i believe that everything and everyone in our life comes as part of Gods plan. I am looking for an honest, caring individual who is educated and witty. ",42,Brahmin - Gour,"Mumbai, Maharashtra, India",,Private Sector,5ft 7in,simran_0002,Hindu
"I am a professional with over 15 years of experience in working in the corporate world at a senior managerial position. I have lived most of my life in Delhi. For the last 2.5 years, I was based in Singapore and recently moved back to India. I am currently taking a short break and pursuing interests that are close to heart in terms of helping rural and underprivileged people. I am a fun loving person who likes to enjoy life.",42,Punjabi,"Gurgaon, Haryana, India",Hindu College,Private Sector,5ft 3in,match71a,Hindu
"Hello, I am Nita from Rajkot (Gujarat). I am Science Graduate and have done PG Diploma in Computer Science. I also possess Diploma in Fashion Designing. My hobbies are Cooking, Creative Arts & Watching TV/Movie.",42,Shewetamber,"Rajkot, Gujarat, India",,,5ft 2in,rajf1067266,Jain
"rajwinder is my relative.our family belongs from amritsar.she has 3 brothers and 1 sister,all are well settled.she is a homely girl and can do all home chores.she is a pure vegetarian.she spent her childhood in delhi.",42,,"Delhi, Delhi, India",,Not Working,5ft 1in,SMF1444285,Sikh
"a simply lady  who is friendly, loving, caring, thoughtful and responsible. values life and family as well. i like to deal with friends and other people. i like nature and love to travel. i have a very flexible personality too...",42,Catholic,,,Private Sector,5ft 3in,summ3r_rain,Christian
"Masters in competitive intelligence. Pleasant in features and carry myself, quite confidently and gracefully. Fairly outgoing and like the company of people with good sense of humor.
",42,Varshney,"Rest of Delhi, Delhi, India",,Private Sector,5ft 1in,shubhiiii,Hindu
"Matrimonial alliance is for my third daughter, who is well educated, caring, and lives her life happily as it comes by. She is a laid back person. She has become vegetarian by choice, not a hypocrite and does not cares.  ",42,Kshatriya,"Ambala, Haryana, India",,,5ft 1in,gurf994238,Hindu
"This profile is created by the girl's sister. All I can say is that the guy she marries will be an extremely happy person to be married to her. Shes a soft spoken sensitive person yet has a dynamic personality. She is currently working as an Operations Head in an ITES Training & Recruitment company in Bangalore. Very professional, a perfectionist and a hard worker, she's gorgeous looking, dynamic, cheerful, graceful, sensitive, good at heart & a nice human being. She loves her family and has always been an asset to the family. She's talented, paints, dances and sings very well and is optimistic & very spiritual as a person. A yoga practitioner she is conscious of her health and enjoys exercising, gym & racquet sports & is also inclined towards alternative therapies. ",42,Sindhi,"Ahmedabad, Gujarat, India",,Others,5ft 3in,indi,Hindu
"hai my sister is very simple person.but life has taken  u turn and it became like????A  CHIRSTION person who really need a life partner  and ready wanted to accept her,  knowing the facts can only approach.",42,Protestant,"Ranchi, Jharkhand, India",,Not Working,5ft 4in,nagf913327,Christian
"I have done my Graduation in Arts, Diploma in Computer Application, Diploma in Business Administration, Diploma in HRD, and Professional Certificate in Web Graphics & Animation on web. 
I m a very down to earth person, who loves life as it comes. I m a fun-loving, caring and responsible person. I love traveling, music, painting, cooking, home making and after marriage my first priority would be my family. I m looking for a person who is loving, caring with a good sense of humor and above all he should be a great human being. Honesty and truthfulness are two qualities, which i always admire. 

I am seeking a marriage with a warm hearted boy who also has strong family values. I believe that marriage is a once in a lifetime commitment and am seeking a boy with a similar outlook and comes from a nice simple family. I like peace and harmony in my life and with those around me. I am a hardworking girl but believe that the time is now right to settle down and find my destined partner to be.

My family is an open-minded, we have a small family of 8 members, and we have happy family with great respect toward life and have high family values. We all prefer to be together and firmly believe in the bonding and togetherness that advents through the unit and entity called FAMILY. My father was Manager (P&A) in O. N. G. C (he is no more he left us on 25/4/2003)& my mother is a housewife. I do have 5 brother and I am alone sister, My elder brother is in MNC working as Manager, Second elder brother is a Marketing Manager of entry Gujarat in a very good Company, first younger brother is in abroad, second younger brother is in Mumbai working as a Software professional in one of the best company in India, and the third younger brother is a special kid (Down Syndrome)  
 

",42,Kayastha,"Ahmedabad, Gujarat, India",Other General University,Not Working,5ft 6in,rs_9171,Hindu
"Hello, I'm a very simple cultured Person who believes in respecting elders and Indian traditional values. For me understanding and honesty is most important than anything else in a relationship and more importantly in a marriage. Two people could be completely different in personalities and tastes but if they understand and respect each other, they could be really potentially ideal life partners. 
",42,Khatri,"Chandigarh, Chandigarh, India",Punjab University,Private Sector,5ft 3in,SMF1542609,Hindu
"I am simple living girl. I like teaching, cooking, traveling and worshiping god. I like to take care of my family and help needy and helpless people. ""TRUST"" is the basic pillar of any relationship which is supported by understanding. ",42,Brahmin,"Chhindwara, Madhya Pradesh, India",Sri Ram College of Commerce (SRCC),Private Sector,5ft 2in,SMF1440419,Hindu
This profile is for my sister.,42,Others,"Mumbai, Maharashtra, India",,Private Sector,5ft 3in,SMF1547191,Christian
"I am a professionally qualified lady but not career oriented. Family consists of a married engineer brother, a married graduate sister and parents, father a retired dy. chief engineer, mother is a housewife. I am looking for someone with a good communication skill, decent lifestyle and who can initiate and engage in intelligent conversation. ",42,Brahmin,"Noida, Uttar Pradesh, India",,Not Working,5ft 3in,SMF1546134,Hindu
"She has graduated in Science with Microbiology as her special subect. Has done D. C. A. , Oracle and Visual Basic in computers too. She gives personal coaching to school students and also helps dad in business. Is a fun loving, caring, confident, witty and an easygoing person. She lives her life to the fullest, thinks positive, laughs and also is always there for her loved ones. She always thanks God for what she is gifted. In leisure time, she likes to work out at the gym, listen to music, watch movies, shop, cook or hang out with friends. 

She respects independence coupled with mutual loving support and believes that communication along with trust and love builds a strong relationship. We are seeking an active, fun loving, professional, mature and educated individual who can be her best friend and also an equal partner to begin with, or you can say, a man who has a deep sense of family values and is well organised with Indian culture.",42,Sikh - Arora,"Ahmedabad, Gujarat, India",,,5ft 5in,ahef925471,Sikh
"I am a fair looking,sensitive,shy to begin with,caring,loving and down to earth person.I work with my father in our family business.I love reading,driving,travelling and listening to music.I am a straightforward,fair and honest person.I value relationships a lot and go out of my way to please people.I am a spiritually inclined person and believe strongly in God and his ways.Trust and faith is something which has to be built for relationships to last.Inconsideration, lies and ingratitude are not in my dictionary.I am a workaholic and socialize moderately.My friends think I am too emotional and sensitive.
I am seeking a honest,ambitious,understanding,caring and loving person.One who knows the values of relationships.A friend and a soulmate rather than a husband.He should be financially stable and be well qualified.",42,Vaishnav,"Mumbai, Maharashtra, India",,Others,5ft,sej1,Hindu
"I'm just another good human being who believes in simplicity. As far as my profession is concerned I'm working with India's biggest media planning house as a General Manager. I plan to work after marriage. I'm a very well balanced person when it comes to my family & my career. I take things as it comes to me, not much of a planner. Each day is a new challenge for me & I hope to learn something new every day. I'm quite independent in nature who believe in the fact that the mantra to make a relationship work is to give time & space to your partner. ",42,Vysya,"Mumbai, Maharashtra, India",,MNC,5ft 3in,mumf660912,Hindu
I was born & brought up in Pune. I like to live life in a simple way. I always respect everybody around me in my family & office. I am from middle class family. Currently I am living in Pune with my Mother & brother.,42,,"Pune, Maharashtra, India",,,5ft 1in,mumf318756,Hindu
"We are an upper middle class Hindu family and our mother tongue is Tamil. I am a retired engineer from H.A.L and currently employed as a consultant with a private aeronautic firm. My wife is a Homemaker. My younger daughter is married to a Software Engineer and is well settled in Bangalore. We are looking for a good companion for my elder daughter. 


My daughter in her own words.......

"" I'm an open minded person having a very positive outlook toward life. By nature warm, fun loving, sincere, honest and religious with clean habits. I am a family oriented person with a blend of modern / traditional values. 

I am in I.T Sales and my job as Senior Business Development Manager gives me ample opportunities for traveling as well as meeting people, both of which I enjoy. My other interests include cricket; music, movies. I find cooking therapeutic and love to cook and feed my family / friends"" 

",42,Mudaliar Arcot,"Bangalore, Karnataka, India",,,5ft 4in,karf276521,Hindu
I am IPS Officer in TamilNadu Cadre.I am Maharashtrian.My family is in Solapur(Maharashtra).I am open minded & simpal.I belive in GOD.I am funloving & carear oriented.,42,Brahmin - Deshastha,"Chennai, Tamil Nadu, India",,,5ft 3in,chef204176,Hindu
"I like reading novels, travelling, being with family. I m a down to earth person. I want a lifepartner who will love me only me. Feelings cannot be expressed in words they are understood by true lovers.",42,Maratha,"Mumbai, Maharashtra, India",Mumbai University,MNC,4ft 10in,SMF1544061,Hindu
I am well settled travel professional having a family responsibility anyone who would like to come and be part of my family and my life is welcome to contact.I am not a great looking personality but can make a great life partner for sure.Ensure you want me and my family before you contact .FC Catholics may contact me.Your position salary or other financial standings are imaterial to me .I want a good man who will take care of me along with my family.,42,Catholic,"Hyderabad, Andhra Pradesh, India",Hyderabad University,Private Sector,5ft 2in,SMF1526641,Christian
" Simple, fun loving  girl.  have done  degree and from Goa. Now, working for a reputed private firm. living with her parents, got two sisters, one married.",42,Catholic,"Margao, Goa, India",,Private Sector,5ft 2in,goaf137727,Christian
i am convent educated and well versed with namaz and Quran Sharif. i am not too fashionable but dress up decent and carry myself very well.  i respect elders. ,42,Others,"Pune, Maharashtra, India",,,5ft 4in,punf1351670,Muslim
"Looking for a Decent & professional Life partner with family values . Marriage is sacred and requires understanding trust maturity and time to make it work"" however on such portals it's become more of fun and time pass for today's genre. It's difficult to pen down thoughts about oneself cos u know what u are but in race of life u r judged by what others feel about you. I have been born and brought up with family values and a simple fun loving homely person and do believe strongly in God and destiny. I have been taught to have human bend towards the intricacies in life. I love driving and enjoy long drives, have passion for cooking,gardening is my hobby. I am fond of pets and wish to do a lot in my life for them. I wish to settle in my race of life. I completed my masters in commerce and computer science & also have CCNA and MCSE as my professional qualification. I strongly believe that happy family life is when two people desire and decide to be together and share the happiness of there lives. ",42,Punjabi,"Delhi, Delhi, India",,MNC,5ft 4in,sonshik,Hindu
"I am a caring, easy going, down to earth, non judgmental, loving, romantic and a straightforward person. People do relate to me easily, maybe I am a good listener. Professionally, I have done well for myself. I was never the one to aim for skies so I am happy where I am today. I am not much of a party hopper. Given a choice, I would like to do mundane things like net surfing, going out for drive, working out at gym and spending as much time as possible with my family. I like to travel as much as I like to laze at home.

I believe life can be fun if lived with person who shares the same passion and values. I do not go for looks but I definitely go for persona, for I feel intelligence and nature gets reflected in one's personality.
",42,Gupta,Others,,Private Sector,5ft 1in,tulip_in,Hindu
"I am an artist & photographer.  I am constantly trying new things &  my favorite thing is to learn languages.  I am a person who is more spiritual than religious &  I am very open minded when it comes to other peoples beliefs. I believe everyone has a right to their beliefs & I was raised in a traditional  home &  while I maintain some of those traditions such as ideas about family &  children I also believe in equality and independence. I am very family oriented. I love traveling...I've been to Europe, Africa, Central America &  lots of cities in the US-I like dancing, going to the movies, museums, operas, plays, the beach sushi, cooking, computers, sports (I love soccer & football) and dogs.  Currently I have two very sweet dogs, so you should like dogs too. I love reading, painting, photography, salsa music, international films &  empirical debates over Starbucks.  I am very romantic, affectionate, understanding & honest.  My favorite thing is going to the movies, all kinds-especially Bollywood &  Spanish films.  ",42,,,,Private Sector,5ft 6in,kalyani_b36,Spiritual
"I live in London since 1992, But I am mobilise to relocate in UK, U. S. A or Canada. I was born and raised in the India with mixture of western and Indian culture and live in joint family. I am loyal, friendly, attractive, very caring, sensitive, affectionate, confident, educated, professional who is kind hearted, a good human being. Trust, honesty and reliability are important qualities for me and the ability to be positive all the time. My interests include movies, music both English and Hindi, Art work, charity work, Cooking, yoga, working out at gym. 
My ideas about life partner: A mixture of plenty of good qualities and some bad. The same as me! He will be kind and caring sometimes and annoy the hell out of me at other times. An Honest, Trust worthy, Caring, loving, understanding and friendly person.",42,,,,Private Sector,5ft 4in,ja5y,Hindu
"I like reading and dancing. I believe that life is full of twists and turns. Sometimes good sometimes bad, still ""the show must go on"" and nothing should be brought to a standstill. I believe in living life fully, enjoying special moments. I'm looking for a sensitive and well-settled guy who gives value to family and friends. I have a strong sense of self and am confident of creating a balance between my professional and family life. 
",42,Sindhi,"Kalyan, Maharashtra, India",,,5ft 1in,tmc2c3600,Hindu
