aboutText,age,caste,city,college,employedIn,height,profileID,religion
"I am an open minded person who knows the limitations, i am here to search my life partner, i am hardworking person from a family of professionals, i am looking out for a like minded person to spend life happily.
																		
																		
",35,Khatri,"Patiala, Punjab, India",Other General University,Private Sector,5ft 4in,SMF1544178,Hindu
my name is sarika my family is shorts my father is expire is 30 year ago i am a single child my mother is labour and me take a private job. i am very emotional,35,,"Nagpur, Maharashtra, India",,,5ft 2in,nagf1377566,Buddhist
"she is simple n down to earth good in nature
n spritual,sensitive  n family values matters a lot for her, love music.wanna be a good designer.father is retired person he was H.R.O. in R.M.S. n mother is house wife she have two brother n two sister all r married .     ",35,Vysya,"Allahabad, Uttar Pradesh, India",,Private Sector,5ft 3in,allf1373539,Hindu
"I'm a B A graduate from a reputed university in Chennai. I'm simple, humorous and down to earth person. I like simple things in life.  My interest is in cooking, listening to music, playing indoor games. I like to improve my knowledge as and when I get an opportunity. ",35,Agarwal,"Chennai, Tamil Nadu, India",,Private Sector,5ft 4in,chef1073892,Hindu
"He is from a good, understanding and traditional family. He has one Younger brother. His father is working in a Pvt sector. Mother is a homemaker. His hobbies are watching television, listening to music, traveling etc. 
  ",35,Brahmin - Iyer,"Delhi, Delhi, India",Indira Gandhi National Open University (IGNOU),MNC,5ft 10in,SMF1591533,Hindu
"I m a social person who believes in honesty & simplicity.I have caring
parents and a younger protective brother at home. I like reading,talking to my friends.",35,Maratha,"Mumbai, Maharashtra, India",,Private Sector,5ft 3in,mumf1309875,Hindu
"She is very simple, cool and fun loving girl. she is working in bangalore.",35,Protestant,"Bangalore, Karnataka, India","Madurai Kamaraj University, Tamil Nadu",Private Sector,5ft 1in,SMF1520547,Christian
"My sister is a cultured girl. She believes in giving respect to elders and loving younger; She is soft spoken and belong to a well honoured, middle class family. B.A from Delhi University; She done MCSE (Microsoft certified system engineer). Working in Admin Dept in CSPL Noida. ",35,Kayastha,"Ghaziabad, Uttar Pradesh, India",College of Arts - Delhi University,Private Sector,5ft 1in,SMF1456950,Hindu
"Hello, I am Avani; I have completed my Undergraduate in Travel & Tourism. I am currently working as a Retail Professional. My friends describe me as: very trusting, confident and bubbly. Hobbies: Reading Cooking Swimming. Views on marriage: Compromise, trust and love.
",35,Rajput,"Brent, Greater London / Middlesex",,Private Sector,5ft 4in,SMF1514485,Hindu
"She is a very loving, loyal friend with a great sense of humor and sensitivity. She also has a highly defined sense of independence and would gel well with those who would respect her for what she is. She believes in fair and equal relationships and will prove to be a great partner to anyone who believes in the same. Shraddha loves to work and she also loves to stay at home and cook once in a while; She loves all kinds of movies and books and can talk in depth about anything under the sun. I would love it if she were to settle down with someone who shares her zest for life and with whom she would find loads of happiness, which she truly deserves.",35,Vaishnav,Others,"Other Fine/ Applied Arts, Graphic/ Web Designing Institute",Private Sector,5ft 4in,othf1002922,Hindu
"I believe in simplicity and want a simple and easy going life partner. A straight forward and honest person, looking for someone who is understanding and broadminded too. My hobbies are cooking, listening to music and spending time with family. ",35,Brahmin,"Mumbai, Maharashtra, India","Other College, Mumbai University",Private Sector,5ft 4in,SMF1574469,Hindu
I am a small town girl. I live with my mother and younger brother though I stay away from home as I work in a convent (boarding school). I love singing as I am a trained singer.That's all about be.,35,Brahmin - Bengali,"Kolkata, West Bengal, India",,,5ft 2in,kolf1113291,Hindu
"Suhan is dietician in VLCC in bahrain. Her parents are from Udipi, Settled in Bangalore since 40 years; father businessman, mother housewife, two sisters and two brothers, one brother is married and one sister is also married. ",35,Sunni,"Bangalore, Karnataka, India","Other College, Bangalore University",Others,5ft 1in,SMF1475375,Muslim
"hello ,I'm optimistic , good-humoured person. I like Sun, summer mornings , playing tennis and listening music espacially when I 'm driving  my car. I like speak with my friends . I plan my aims , my dreams  and achieve them, but it would be much better to have my intimate soul to do  this together. :-)",35,Catholic,Others,,,5ft 7in,othf978640,Christian
"I am sweet, simple and sincere girl, very soft in nature, creative, well educated and belongs to a very reputed family. Like music, cooking, reading and shopping. I am looking for the one who compliments me & vice-verse.  ",35,Kayastha,"Delhi, Delhi, India",Manipal Academy of Higher Education (MAHE),Private Sector,5ft,SMF1593743,Hindu
"I am a soft spoken person, Look much younger than my age. My family and friends describe me as Intelligent, friendly, caring, family oriented, bubbly, lively, down to earth, very positive, believe in destiny, patient, deep thinker and good listener :). Dont consider beautiful as I think I am more of a photogenic.Love painting, outdoor sports, experimenting on food, listening to good music, exploring new places etc.
My values are modern yet have respect for Indian traditions and culture. ",35,,"Delhi, Delhi, India",,Others,5ft 1in,SMF1445054,Hindu
"My sister is down to earth, friendly and a confident girl. She has quest for knowledge and believes in standing by integrity. She is an avid reader, quite adventurous and loves traveling. Currently she is working as Asst. Manager - Financial Sector for HSBC, Hyderabad. ",35,Catholic,"Bangalore, Karnataka, India",,Private Sector,5ft 7in,banf1039252,Christian
"career orient,self occupation,want to stand on own legs,like joint family ,interest in fashion and jwelery designing ,well beautician,mostly prefer in maharashtra  at pune and mumbai ,very good communication.",35,,"Kolhapur, Maharashtra, India","Shivaji University, Maharashtra",Others,5ft 3in,SMF1406248,Buddhist
"Committed, loyal.god-fearing,compassionate and caring with strong family values.Does not believe in hypocrisy.Father Medical Doctor in CHs. Mother a post graduate and a house maker. younger sister a dentist",35,Punjabi,"Delhi, Delhi, India",,State Government,5ft 3in,delf1287967,Hindu
"Hi, 
I belong to a simple middle class family,intelligent,educated and a self made individual.We basically belong to Bhopal,Madhya Pradesh.Convent educated,I completed my MBA with Finance as specialisation in 2001 from Indore and have been working with MNC/Private life insurance industry in Customer Service & Operations since then.Currently I am working as a Chief Manager with a leading insurance player,Reliance Life Insurance Co. Ltd in Mumbai.

I enjoy music,watching movies,long drives/travelling & reading.Not only am I a mature and successful professional I am also an excellent homemaker. ",35,Kayastha,"Mumbai, Maharashtra, India",,Private Sector,5ft 3in,SMF1393457,Hindu
"Neetu is a very loving and caring person. She is an independent girl who loves to stay indoors, enjoys company of family. 
She is competent and modern. She is someone with a warm personality. She enjoys camping and loves barbequed food. We are looking for a suitable match for her with Indian background and modern perspective. Someone who can respect her and adore her, she deserves it. 
",35,Punjabi,"Los Angeles, California",Others,MNC,5ft 2in,SMF1565903,Hindu
"Simple, ambitious, energetic,practical, selective and fun-loving. Praise and like clear-hearted people. Dislike those whose who consider drinking alcohol as a way to enjoy. God has made far better ways to enjoy life. ",35,Brahmin - Saryuparin,"Pune, Maharashtra, India","Apeejay School of Marketing, Delhi",Private Sector,5ft 4in,SMF1393973,Hindu
I am sujatha. I am from Mangalore in Karnataka. Working in Bangalore as Administrator. I have two brothers. Both are engineers. One sister got married. My dad is retired engineer. Mom is housewife. I am down to earth and drama free and straight forward.,35,Brahmin,"Mangalore, Karnataka, India",,Private Sector,5ft 4in,banf878840,Hindu
"She is simple and caring.She is sweet by nature.She has done M.Sc.,M.Phil and B.ED.
She is youngest child in our family.In our family,we are five sisters and one brother.Our family is educated family.",35,Brahmin,"Jaipur, Rajasthan, India",,Private Sector,5ft 6in,SMF1393474,Hindu
"Am softhearted and family oriented person. I also believe in work life balance and understand the significance of the same in happy go lucky life. Presently working for a MNC in Gurgaon. Work Experience of 5 years in reputed organizations. Presently working with Germany Company.
",35,Arora,"Rest of Delhi, Delhi, India",,MNC,5ft 4in,ncrf896042,Hindu
"I AM SIMPLE GIRL, DONE 12TH FROM ENGLISH MEDIUM, FASHION DESIGNING COURSE AND LIKE TO REMAIN BUSY IN MY WORK. I AM GOOD AT COOKING AND LIKE TO PREPARE FOOD AND SERVE.",35,,"Pune, Maharashtra, India","Shivaji University, Maharashtra",Others,5ft 3in,SMM1527743,Buddhist
"Hi i am Megha.Residing in Pune. I stay with my parents.My father is retired,mother is a homemaker and brother is working as a Service engineer in MNC company.",35,Vannar,"Pune, Maharashtra, India",Other General University,Private Sector,5ft 6in,punf907547,Hindu
"Our daughter is a blend of modern and traditional values.  She is born and brought up in Mumbai. Her education is MBA (specialization HR) from ICFAI Mumbai (May 2011) in addition to B.A. from K.C. College, Churchgate, Mumbai. Presently employed as senior executive corporate finance with a category 1 merchant banking organization. She is not career oriented but feels that it is better to be independent as today time has become very uncertain. In long run she prefers to be a home maker. She loves watching new movies, listening to music, watching TV, reading books, shopping and seeing new places. For us horoscope match is very crucial. Her horoscope details are: Date of birth 5-6-1978, Time 18.30 hrs Place Mumbai. ",35,Agarwal,"Mumbai, Maharashtra, India","ICFAI, Other Cities",Private Sector,5ft 4in,mumf884150,Hindu
"I am simple and hard working; hate smoking, drinking and bad habits: like angry, beating and fighting with others; i am interested in a person who is calm and not interested in dowry and want a partner from same caste.  ",35,Balija,"Navi Mumbai, Maharashtra, India","Other College, Mumbai University",Not Working,5ft 7in,SMF1411111,Hindu
"Personality				:	Good looking, Charming and Smart Personality.    
Fair     Complexion.      Height   (160 cm).   Well  Groomed.    High  family orientation. Traditional values.

Education 				:      	Professional Diploma in International Business    
         (PDIB), All India Management Association (AIMA),
	New Delhi.
       	B.Com (H) - Delhi University, New Delhi. 
	(Member of Music Society).
Class XII (CBSE) - Delhi Public School, 
R.K. Puram, New Delhi. 
(Merit/Scholar Badge & House Captain)
  
Profession				:	Assistant Vice President (AVP)  in leading MNC 
                                    Bank in   New Delhi. Total annual package   
 			Rs.15.0 lakhs plus
 
Hobbies				:	Professional   Training   in  Classical Music
(Vocal); completed Prabhakar (6 years) 
equivalent to B.A.

Father					:	Shri Ajit Kumar Gupta 
Retired in Sep 08 as Adviser in Central Ministry.
B. Tech. - IIT, Kanpur (1971).  
M.  Engg. - AIT, Bangkok.

Mother				:	Smt. Usha Gupta, 
						Principal, Senior Secondary School of Delhi 
Administration.
						B.Sc. - Lady Irwin College, New Delhi.
						M.Sc. - M.S. University, Vadodara.

Sister					:	Mrs. Shruti Garg
B.A. Eco.(H), Lady Sri Ram College, D.U.
Post Graduate Dip. in Mgmt. (PGDM), AIMA. 
Worked with HSBC. Now teaching. 
Seven year old daughter and an infant son ",35,Agarwal,"Delhi, Delhi, India",,MNC,5ft 3in,delf916411,Hindu
I m very simple high thinking person looking for someone who can understand me and my family who can take care my and my family responsibilities and I would like to keep my partner always happy by all her wishes and plans.,35,Vanjari,,,Private Sector,5ft 7in,SMF1525869,Hindu
"A creative soul who finds an outlet designing couture based out of Bhopal. Own my Boutique and that spells my individuality. A businesswoman at the core, but I do get emotionally vulnerable sometimes.",35,Kayastha,"Bhopal, Madhya Pradesh, India",,Others,5ft 6in,bhof1009270,Hindu
Hi i am very simple and belive in hard work my family is traditional family. i had two brother both are married and well settle father is retired and mom is house wife. ,35,Brahmin - Saryuparin,"Amravati, Maharashtra, India",,,5ft 1in,amrf1104091,Hindu
"My daughter is a caring, loving & homely girl. Her hobbies are cooking, teaching, reading & listening to music. She has done diploma in Montessori course and is an Abacus trainer. We are a respectable, and cultured professional family. I am a practising C.A. My wife is a homemaker. My elder son is working with IBM as an Asstt Manager - Finance. ",35,Brahmin - Gaur,"Kolkata, West Bengal, India",,,5ft 3in,kolf770586,Hindu
"you have to converse n meet several times to know a person actually..but i will give u some idea abt me..i am very emotional n sencitive person..faithful n trustworthy,can love a person from the depth of my heart  if he loves me too...i love to dance..have learnt salsa,tango n swing and want to learn diff types of dance n perform also when i get chance..have got titles of ""Best Female Dancer"" n ""Nache Mayuri""...

i used to participate in diff games n have got medals n certificates in school n i still love to play outdoors..

i love to dress up smartly n maintain my figure so eat accordingly :)
i am very romantic also.. candle light dinners,long drives,dancing n rain makes me mad..
i have gd tastes of life in everyfield...i love decorating my house n make it a beautiful place...

i also read sometimes n watch gd romantic comedies or movies which give good lesson to our society..

i have live n let live attitute..i believe in giving space to my partner n want the same for me..

for me marriage is 2 ppl sharing there happiness n sorrows together...supporting each other in fufilling there dreams loving each other from the depth of there hearts..being loyal n sincere..n giving respect to each other...
i believe there is no boss of the house every decision should be taken mutually n whtever suits best for both..i want my husband to be my best friend n have similar views.
so if interested pls send me a msg across and i will get back to you..thanks :)
",35,Sikh - Khatri,"Delhi, Delhi, India",,,5ft 3in,delf826773,Sikh
god fearing with religious bent of mind seeking a true and sincere relation.My weakness is i cant take lies.Honesty is the best policy are not just words for me. It means a lot to me. Marriage is not just an  institution bt it is the most pious realtion but unfortunately people take it as a fun. A marriage knot tied on the foundation of lies and frauds is not a marriage. It is shere selfishness and greatest sin in the eyes of God.Now you can well imagine what could have happened. Believe in your instincts and then proceed. This is all i can say. Best of luck to all of you. NANAK NAAM CHAD DI KALA TERE BHANE SARBAT DA BHLA.,35,Sikh - Khatri,,,,5ft 6in,chaf750206,Sikh
"Father expired, mother house wife, residing at Tenali town, looks simple and honest. Has three elder sisters and two younger sisters. Two are married. Her hobbies are reading books and watching television etc.",35,Kamma,"Guntur, Andhra Pradesh, India",,Not Working,5ft 5in,SMF1525259,Hindu
"I have completed my Bachelors Degree from Pune University in Literature with Distinction; Values: Important and enduring beliefs or ideals shared by the members of a culture about what is good or desirable and what is not. Motto in life-Success is not final, failure is not fatal: it is the courage to continue that counts. Views on marriage: The primary purpose of marriage for me is loving, caring, supporting, understanding, dedication, crystal clear transparency, loyalty, respect, companionship and of course a life long relationship or commitment. ",35,Kayastha,"Kolkata, West Bengal, India",,Private Sector,5ft 3in,punf875558,Hindu
"Born and raised in the US, I'm an optimistic person with a smart and fun personality. I like to smile and laugh with friends and it's usually the small things I enjoy most. As hobbies, I'm usually reading, watching movies, hanging out with friends, going out to eat, or catching up on photography. I also like to travel and have an interest in museums and art. Professionally, I am a Senior IT Project Manager for a Multinational Corporation based in the US.  I'm well established in my career and I enjoy working on new and challenging projects.
",35,Sikh - Gursikh,,,MNC,5ft 6in,SMF1497323,Sikh
"Hi, I am a simple girl. I love & respect my parents a lot. I am a homely person. I seriously believe that marriage is an institution which is built on the basis of love, trust & understanding each others needs & problems. ",35,Others,"Pune, Maharashtra, India",,Private Sector,4ft 11in,punf801568,Christian
"I believe in picking up right things both from east and west culture.I am a very cool headed person,soft spoken and enjoys travelling to different places. I am ambitious  and enjoys doing full justice to my work and potential. I am also very friendly in nature and do get along well with people who i feel are friendly and grounded, but still interesting. I love fun loving people who can make others laugh and keep the atmospher lively  i immensely admire people who are simple, down to earth and donot pretend someone they are not
",35,Brahmin,"Ghaziabad, Uttar Pradesh, India",,,5ft 1in,ghaf973212,Hindu
"I am cool and soft spoken person i like
my panter is my best friend and Handsome smart and tall.He also open 
minded and soft spoken person and no
smoke no drink i just hart that type
of person.",35,Brahmin - Kulin,"Kolkata, West Bengal, India",,,5ft 2in,kolf1265797,Hindu
"I am good looking, kind hearted, broad minded girl, working as a PLAYBACK SINGER, TV ARTIST, ANCHOR, AND WRITER. I have done MA. MED and secured GOLD MEDAL in Hindustani music. Here in search of my real and true life partner who is having some valuable qualities, loving, caring, intelligent, understanding, adjustable, confident, humorous, fun loving, supportive, romantic, well cultured and give importance to the institution of marriage as well as to his life partner. ",35,Lingayath,"Bangalore, Karnataka, India",,Private Sector,5ft 2in,SMF1473207,Hindu
"about my sister :my sister name is kavita.this is homely name.abd her kundli name is misha. she is a simply girl. she is active her work. she's like music , watching tv programmes , hindi movies  & cooking. she want to marry nice  & simply person.",35,Hindu-Others,"Vadodara, Gujarat, India",,,5ft 3in,barf1362021,Hindu
"God fearing girl working with MNC seeks loving, God fearing and caring groom preferably Tamil Christian and baptized. I'm born and brought up in Mumbai, have an elder brother & sister and I live with my parents. Sister is married and settled abroad.",35,Others,"Mumbai, Maharashtra, India",,MNC,5ft 1in,mumf920395,Christian
"I am good looking, fair, tall, seeking similar partner. i m homely, love cooking, house hold chorus. enjoy movies, outgoing, traveling, eating out, friends, family, relatives, siblings, my job, etc. ",35,Kayastha,"Delhi, Delhi, India",IIM-Ahmedabad,MNC,5ft 5in,SMF1440606,Hindu
"My sister is simple living girl. She is M.com and MBA, and is is working in Haldwani. ",35,Rajput,"Haldwani, Uttaranchal, India",Other General University,Private Sector,5ft 3in,delf565423,Hindu
"I am simple, down to earth, confident, family oriented girl,who loves to enjoy in traditional family.I have completed MBBS from india and also completed MBA in healthcare and human resource management. and now preparing for step 1 USMLE.",35,Vaishnav,"Belleville, New Jersey",,Private Sector,5ft 5in,newf981475,Hindu
"She is good natured, soft spoken.honest, simple, down to earth. She is very fair. we r 4 siblings, Father Govt. retired person, mother is housewife. one brother has completed B.com. ",35,Kayastha,"Ballia, Uttar Pradesh, India",,Private Sector,5ft 3in,blif1337838,Hindu
"We are basically from Allahabad, i am the only brother and have 2 sisters. One is married and she is the youngest one. We believe in simplicity, honesty and family values and we are looking for the same kind of match. ",35,Kayastha,"Noida, Uttar Pradesh, India",,,5ft 3in,delf1333460,Hindu
"I am a simple girl of 5 feet 3 inches. Done diploma in computer applications. Own a flat in Delhi.  Interested in watching films, listening songs and surfing computers or internet. ",35,Brahmin,"Delhi, Delhi, India",,,5ft 3in,ncrf1058026,Hindu
"i want my husband very understanding, fun loving, caring & also give important to family. abt me i m very frndly by nature also i beliving in god.I like to travelling also. ",35,96K Kokanastha,"Mumbai, Maharashtra, India",,MNC,5ft 1in,mumf1235716,Hindu
"Hii,

In short am a very simple person. I love people who have helpful nature as well as lot of understanding,  trustworthy,  supportive and very caring.",35,Sonar,"Navi Mumbai, Maharashtra, India",,MNC,5ft 3in,navf1133242,Hindu
"hi, my name is manisha rakhasia , i am living in kandivali,born n brought up in mumbai, very fair beautiful ,charming ,looking younger than my age, smart personality,trendy in line with latest fashion,home loving, happy go lucky person ,very striaght forward. ",35,Vaishnav,"Mumbai, Maharashtra, India",,Private Sector,5ft,mumf388227,Hindu
"I belong to an upper-middle class educated nuclear family working with a Financial Services organisation and am looking for someone who comes from similar salaried class back ground. I love to learn new things in life. People say I am a sunshine personality. I love to hit the dance floor sometimes and equally comfortable at work place and at home doing simple chores and tastefully managing my heaven.Father was a metallurgical engineer and an XLRI ite, mother is an educated and simple home maker and younger brother works for a Top Class MNC. ",35,Sikh - Khatri,"Delhi, Delhi, India",,Private Sector,5ft 5in,delf905668,Sikh
"she is simple,sober and understand the social values and duties . she is spiritual and  helpful nature at the same time she is confident &  career oriented girl. strongly believe in god and nature......... ",35,Brahmin - Goswami/Gosavi,"Vadodara, Gujarat, India",,Private Sector,5ft 2in,barf734715,Hindu
"Am a very caring, loving, cheerful, mature and responsible person and am very much straight forward in my approach. ",35,Brahmin,"Vadodara, Gujarat, India",,Private Sector,5ft 3in,barf422408,Hindu
"Like to be with family and friends. Health and Fitness are top on the list. Regularly pursue Yoga n walking. I like Gadgets, indulged in sports especially adventure, swimming, squash, golf, badminton etc and I am an ardent fan of active sports and like to play rather than watch. Like to keep myself updated with happenings all around the world. Also am interested in the stock market, music - Pop, rock, R&B n sometimes Ghazals n bollywood music. I am also very fond of pets as I have had them all my life. I come from a progressive minded family. Father was in the Army Aviation and has flown helicopters in places like Siachen n J&K. My parents have separated. Mother is working in the US however I do keep in regular touch with her. I have a younger brother who is in the Indian Navy and presently posted at Delhi. In my free time like to drive, venture out to restaurants (as i am foodie) try out different cuisines and watch an english movie, news or sports channel. Sometimes watch a movie that has caught my fancy as the multiplex is really close to my house :-) Future aspirations is to work towards my goals (that includes having a venture of my own) travel see places n meet diferent people n have a happy, loving n peaceful married life. More when we meet in person ",35,Brahmin,"Rest of Delhi, Delhi, India",,,5ft 4in,punf1099630,Hindu
She is beautiful sweetnatured and religious. She is working as an Assistant professor in a college near Chandigarh. Father a senior officer.brother happily married.,35,Arora,"Ambala, Haryana, India",,Others,5ft 1in,panf1223314,Hindu
"Hi, I am working for a Bank and belong to a well educated family. I would love to live a life with a partner who is understanding and supportive. He should be fun loving and live life to fullest. I dont believe in looks, but should be compatible with me. I am interested in holistic stream and a person associated with Art of Living when ever time permits. I have travelled a lot of places in India and enjoy company of nature. I like to socialise with my people, relatives and siblings. Have a close group of friends also. ",35,Brahmin - Saryuparin,"Bangalore, Karnataka, India",,MNC,5ft 2in,raif1305940,Hindu
